id,fake-company-name,company-email,slogan
"794","Orn Ltd","chadrick.skiles@ryan.co.th","พัฒนาโครงสร้างคุณภาพสากล"
"795","Rempel Ltd","bergstrom.virgie@beatty.mi.th","ส่งเสริมเทคโนโลยีสู่ผู้บริโภค"
"796","Maggio Ltd","harvey.sharon@parker.net.th","ประสานตลาดที่โปร่งใส"
"797","Zulauf Ltd","isaiah.abshire@borer.net.th","เชื่อมต่อความคิดอย่างมีประสิทธิภาพ"
"798","Barton Ltd","npowlowski@harris.net.th","ส่งเสริมความคิดอย่างไร้ที่ติ"
"799","Pouros Ltd","kayley.thiel@brekke.ac.th","เชื่อมโยงสถาปัตยกรรมอย่างสากล"
"800","Ritchie Ltd","xwisoky@gusikowski.ac.th","ประสานประสบการณ์สมัยใหม่"
"801","Greenholt Ltd","kelvin90@mclaughlin.com","พัฒนาเนื้อหาอย่างไร้ที่ติ"
"802","Blanda Ltd","amari76@schiller.mi.th","สรรสร้างตลาดอย่างไร้ที่ติ"
"803","Kuhic Ltd","asha54@gutmann.mi.th","ประสานเครือข่ายที่ปรับตัวได้"
"804","Dibbert Ltd","eloisa.stoltenberg@rogahn.th","เชื่อมต่อโครงสร้างพร้อมใช้งาน"
"805","Kuvalis Ltd","ullrich.gust@auer.th","เปลี่ยนเครือข่ายคุณภาพสากล"
"806","Lang Ltd","jhoppe@osinski.in.th","พัฒนาโครงสร้างคุณภาพสากล"
"807","Thompson Ltd","wbradtke@flatley.co.th","เชื่อมต่อประสบการณ์สมัยใหม่"
"808","Collier Ltd","ronny.conn@runolfsdottir.th","เปลี่ยนสถาปัตยกรรมที่โปร่งใส"
"809","Kuhic Ltd","schumm.andrew@wolff.co.th","เชื่อมโยงโครงสร้างเพื่อการเปลี่ยนแปลง"
"810","Gorczany Ltd","cole.johnathon@bernhard.mi.th","ประสานเนื้อหาที่สร้างสรรค์"
"811","Frami Ltd","furman.bode@monahan.net.th","เชื่อมต่อเทคโนโลยีที่น่าดึงดูด"
"812","Cartwright Ltd","edyth79@cartwright.in.th","สรรสร้างตลาดอย่างไร้ที่ติ"
"813","Waelchi Ltd","bria.stehr@mcclure.net.th","เปลี่ยนผู้ใช้สมัยใหม่"
"814","Zulauf Ltd","dorothy37@herzog.com","สรรสร้างผู้ใช้คุณภาพสากล"
"815","Erdman Ltd","matilda.rogahn@larkin.com","เชื่อมต่อเครือข่ายที่มีคุณค่า"
"816","Schmidt Ltd","heaney.annie@lueilwitz.net.th","เปลี่ยนเนื้อหาอย่างมีประสิทธิภาพ"
"817","Wiza Ltd","maureen.runolfsson@turcotte.net.th","ส่งเสริมเครือข่ายพร้อมใช้งาน"
"818","Zboncak Ltd","gusikowski.steve@leannon.in.th","เชื่อมโยงผู้ใช้ที่แข็งแกร่ง"
"819","Flatley Ltd","gerlach.jonas@murazik.or.th","ส่งเสริมเนื้อหาอย่างไร้ที่ติ"
"820","Jaskolski Ltd","krystina34@sauer.mi.th","เชื่อมโยงประสบการณ์สู่ผู้บริโภค"
"821","Stoltenberg Ltd","ricky.funk@damore.co.th","เชื่อมโยงสถาปัตยกรรมอย่างไร้ที่ติ"
"822","Stroman Ltd","richard09@kassulke.ac.th","สรรสร้างตลาดที่มีความหมาย"
"823","Brekke Ltd","myrna92@spencer.com","สรรสร้างระบบเพื่อการเปลี่ยนแปลง"
"824","Simonis Ltd","mayert.olaf@vonrueden.in.th","เปลี่ยนอุตสาหกรรมคุณภาพสากล"
"825","Rohan Ltd","eliseo.predovic@hermiston.or.th","เชื่อมโยงเทคโนโลยีอย่างไร้รอยต่อ"
"826","Hickle Ltd","enos14@murphy.or.th","เปลี่ยนอุตสาหกรรมรูปแบบใหม่"
"827","Krajcik Ltd","cheyenne.kuhlman@kuhlman.in.th","ประสานเทคโนโลยีที่น่าดึงดูด"
"828","Walker Ltd","nlemke@reichel.net.th","เปลี่ยนสถาปัตยกรรมที่แข็งแกร่ง"
"829","Stroman Ltd","bosco.mittie@hand.go.th","เชื่อมต่อเครือข่ายที่น่าดึงดูด"
"830","McKenzie Ltd","garnet16@schimmel.ac.th","เปลี่ยนตลาดที่สร้างสรรค์"
"831","Spencer Ltd","veum.abdul@koepp.or.th","ส่งเสริมเนื้อหาอย่างไร้ที่ติ"
"832","Zboncak Ltd","tristian.fahey@jacobi.co.th","เชื่อมต่อเนื้อหาอย่างสากล"
"833","Leffler Ltd","henderson.gulgowski@koch.ac.th","เปลี่ยนเครือข่ายสู่ผู้บริโภค"
"834","Powlowski Ltd","lindgren.jordan@white.th","สรรสร้างสถาปัตยกรรมที่ปรับตัวได้"
"835","Ebert Ltd","elmira24@veum.co.th","ส่งเสริมโครงสร้าง24 ชั่วโมง"
"836","Lebsack Ltd","squitzon@reilly.or.th","เชื่อมต่อระบบที่แข็งแกร่ง"
"837","Keebler Ltd","jordi.wehner@hilpert.net.th","เปลี่ยนผู้ใช้อย่างไร้ที่ติ"
"838","Stamm Ltd","murphy55@mckenzie.or.th","พัฒนาความคิดที่มีคุณค่า"
"839","Mohr Ltd","major.west@emard.mi.th","เชื่อมโยงตลาดรูปแบบใหม่"
"840","Conroy Ltd","kabshire@klein.in.th","ประสานอุตสาหกรรมที่โปร่งใส"
"841","Keebler Ltd","tjones@homenick.go.th","เชื่อมต่ออุตสาหกรรมรูปแบบใหม่"
"842","Cartwright Ltd","vluettgen@erdman.net.th","เชื่อมต่อเครือข่ายสมัยใหม่"
"843","Kub Ltd","volkman.domenick@rosenbaum.net.th","ประสานผู้ใช้ที่แข็งแกร่ง"
"844","Stark Ltd","paris.gorczany@corkery.net.th","เชื่อมโยงสถาปัตยกรรมพร้อมใช้งาน"
"845","Weber Ltd","conn.mara@hilpert.go.th","ประสานตลาดอย่างสากล"
"846","Witting Ltd","smith.merritt@abernathy.net.th","เชื่อมโยงอุตสาหกรรมอย่างมีประสิทธิภาพ"
"847","Gulgowski Ltd","everardo.corwin@walker.in.th","เปลี่ยนความคิดที่มีความหมาย"
"848","Lubowitz Ltd","melba25@schneider.mi.th","เชื่อมโยงตลาดที่มีคุณค่า"
"849","Bernhard Ltd","cblanda@towne.co.th","สรรสร้างผู้ใช้คุณภาพสากล"
"850","Kihn Ltd","curt53@bednar.ac.th","ส่งเสริมผู้ใช้สู่ผู้บริโภค"
"851","Willms Ltd","kailey.quigley@pfeffer.net.th","พัฒนาระบบที่สร้างสรรค์"
"852","Ortiz Ltd","omer47@yundt.net.th","เปลี่ยนระบบที่แข็งแกร่ง"
"853","Wintheiser Ltd","mlockman@stracke.ac.th","เปลี่ยนเนื้อหาพร้อมใช้งาน"
"854","Bednar Ltd","madge.keeling@reichel.co.th","ประสานเนื้อหาที่มีคุณค่า"
"855","Nienow Ltd","kris.ezequiel@cartwright.or.th","ส่งเสริมอุตสาหกรรม24 ชั่วโมง"
"856","Denesik Ltd","casper.rupert@mertz.net.th","พัฒนาระบบสู่ผู้บริโภค"
"857","Barton Ltd","initzsche@rolfson.com","เชื่อมโยงตลาดที่สร้างสรรค์"
"858","Towne Ltd","schulist.henriette@oconner.co.th","เชื่อมต่อระบบที่มีคุณค่า"
"859","Larson Ltd","wauer@rohan.or.th","สรรสร้างเทคโนโลยีอย่างไร้รอยต่อ"
"860","Kreiger Ltd","jamarcus52@hoppe.ac.th","ประสานเนื้อหาสมัยใหม่"
"861","Jaskolski Ltd","drew43@tillman.net.th","ส่งเสริมสถาปัตยกรรมเพื่อการเปลี่ยนแปลง"
"862","Huel Ltd","ayana61@hilpert.in.th","เปลี่ยนผู้ใช้สมัยใหม่"
"863","Ernser Ltd","qcarter@doyle.go.th","ประสานผู้ใช้ที่โปร่งใส"
"864","Wisoky Ltd","ygraham@schinner.mi.th","เชื่อมโยงโครงสร้างที่ปรับตัวได้"
"865","Collier Ltd","yessenia57@altenwerth.in.th","เชื่อมต่อเนื้อหาที่สร้างสรรค์"
"866","Lang Ltd","everett84@cummerata.go.th","พัฒนาอุตสาหกรรมรูปแบบใหม่"
"867","Kuphal Ltd","tflatley@reynolds.in.th","เชื่อมโยงตลาดที่มีความหมาย"
"868","Goldner Ltd","estelle.lakin@bergnaum.or.th","ประสานสถาปัตยกรรมพร้อมใช้งาน"
"869","Kovacek Ltd","herzog.yasmeen@wyman.mi.th","พัฒนาประสบการณ์อย่างไร้รอยต่อ"
"870","Leannon Ltd","hellen59@block.in.th","เชื่อมต่อเทคโนโลยีที่ปรับตัวได้"
"871","Bahringer Ltd","schuster.jamison@bayer.or.th","เชื่อมต่อตลาดพร้อมใช้งาน"
"872","Gislason Ltd","lcronin@towne.net.th","เชื่อมโยงตลาดที่มีความหมาย"
"873","Lueilwitz Ltd","botsford.brisa@kohler.th","ประสานความคิดอย่างมีประสิทธิภาพ"
"874","Larkin Ltd","bernard76@kerluke.go.th","สรรสร้างตลาดสมัยใหม่"
"875","Lynch Ltd","randi29@spencer.co.th","พัฒนาตลาดอย่างสากล"
"876","Harber Ltd","bratke@raynor.in.th","เชื่อมต่อความคิดรูปแบบใหม่"
"877","Pouros Ltd","swaniawski.joannie@tremblay.in.th","เชื่อมโยงเนื้อหาอย่างไร้รอยต่อ"
"878","Hudson Ltd","drew.johnson@bernhard.com","พัฒนาความคิดรูปแบบใหม่"
"879","O'Kon Ltd","tremblay.lacy@greenfelder.mi.th","ส่งเสริมเนื้อหาคุณภาพสากล"
"880","Spinka Ltd","favian64@pfannerstill.go.th","ส่งเสริมตลาด24 ชั่วโมง"
"881","Hickle Ltd","sydnee.stokes@spinka.co.th","เปลี่ยนตลาดที่แข็งแกร่ง"
"882","Kunde Ltd","kozey.ricardo@eichmann.or.th","พัฒนาสถาปัตยกรรม24 ชั่วโมง"
"883","Kub Ltd","donnelly.herminio@rolfson.net.th","พัฒนาตลาดที่โปร่งใส"
"884","Daniel Ltd","vonrueden.harvey@sauer.mi.th","เชื่อมต่อตลาดเพื่อการเปลี่ยนแปลง"
"885","Legros Ltd","dmetz@kemmer.net.th","เชื่อมต่อเครือข่ายที่สร้างสรรค์"
"886","Padberg Ltd","ed11@fisher.th","เปลี่ยนผู้ใช้ที่โปร่งใส"
"887","Mraz Ltd","rosemarie69@robel.com","เชื่อมต่อเนื้อหาอย่างสากล"
"888","Metz Ltd","abbott.ursula@zulauf.in.th","สรรสร้างความคิดสู่ผู้บริโภค"
"889","Cummerata Ltd","lesly.hickle@treutel.mi.th","ประสานเครือข่ายที่สร้างสรรค์"
"890","Lowe Ltd","brady.simonis@casper.go.th","เชื่อมโยงโครงสร้าง24 ชั่วโมง"
"891","McKenzie Ltd","gabe68@spencer.com","สรรสร้างผู้ใช้อย่างสากล"
"892","Schmitt Ltd","kaden.hilpert@purdy.mi.th","สรรสร้างความคิดที่ปรับตัวได้"
"893","Walsh Ltd","reymundo.runolfsson@bogisich.co.th","เปลี่ยนเทคโนโลยีที่น่าดึงดูด"
"894","Jerde Ltd","olind@wisoky.or.th","พัฒนาอุตสาหกรรมพร้อมใช้งาน"
"895","Hermann Ltd","randall10@hill.th","เชื่อมโยงประสบการณ์24 ชั่วโมง"
"896","Goyette Ltd","thomas.ohara@lemke.mi.th","เชื่อมต่อตลาดที่น่าดึงดูด"
"897","Cummings Ltd","summer11@kertzmann.ac.th","พัฒนาเนื้อหาที่น่าดึงดูด"
"898","Hills Ltd","maritza.feeney@zieme.ac.th","สรรสร้างตลาดอย่างไร้รอยต่อ"
"899","Aufderhar Ltd","hansen.benedict@kozey.mi.th","ส่งเสริมสถาปัตยกรรมที่มีความหมาย"
"900","Rath Ltd","makenna43@orn.net.th","ส่งเสริมเนื้อหาพร้อมใช้งาน"
"901","Sporer Ltd","darrion.reichert@bergnaum.in.th","ประสานตลาดเพื่อการเปลี่ยนแปลง"
"902","Bechtelar Ltd","uhuels@haag.co.th","เชื่อมโยงเครือข่ายที่แข็งแกร่ง"
"903","Gibson Ltd","breitenberg.cedrick@eichmann.co.th","เชื่อมโยงเทคโนโลยีพร้อมใช้งาน"
"904","Cormier Ltd","robert68@hamill.go.th","ประสานเทคโนโลยีคุณภาพสากล"
"905","Runolfsdottir Ltd","lwilliamson@carter.or.th","เชื่อมโยงเนื้อหาอย่างไร้ที่ติ"
"906","Bashirian Ltd","orie.beier@roberts.net.th","เชื่อมโยงตลาดที่แข็งแกร่ง"
"907","Johnson Ltd","mitchell.adele@murray.co.th","ส่งเสริมระบบ24 ชั่วโมง"
"908","Sanford Ltd","ignacio95@okuneva.go.th","เปลี่ยนผู้ใช้ที่มีความหมาย"
"909","Dare Ltd","jhomenick@muller.go.th","เปลี่ยนเครือข่ายที่สร้างสรรค์"
"910","Donnelly Ltd","mann.heber@collier.ac.th","เปลี่ยนอุตสาหกรรมรูปแบบใหม่"
"911","Kemmer Ltd","turcotte.garrison@langosh.mi.th","สรรสร้างสถาปัตยกรรมสมัยใหม่"
"912","Donnelly Ltd","emilia79@mccullough.or.th","ส่งเสริมโครงสร้างที่โปร่งใส"
"913","Konopelski Ltd","lhyatt@kreiger.th","ส่งเสริมประสบการณ์อย่างมีประสิทธิภาพ"
"914","Borer Ltd","mmarquardt@parisian.go.th","เชื่อมโยงความคิดพร้อมใช้งาน"
"915","Monahan Ltd","treutel.kathleen@schuster.net.th","พัฒนาเครือข่ายอย่างไร้รอยต่อ"
"916","Mraz Ltd","mokeefe@johnston.go.th","พัฒนาอุตสาหกรรมเพื่อการเปลี่ยนแปลง"
"917","Lindgren Ltd","letitia.cormier@hermann.or.th","เชื่อมโยงประสบการณ์ที่มีความหมาย"
"918","Schoen Ltd","nyasia60@kirlin.or.th","พัฒนาอุตสาหกรรมสู่ผู้บริโภค"
"919","Eichmann Ltd","norris60@bernhard.com","เชื่อมต่อผู้ใช้ที่แข็งแกร่ง"
"920","McClure Ltd","haag.aisha@nitzsche.th","พัฒนาเทคโนโลยีอย่างไร้ที่ติ"
"921","Rempel Ltd","reilly.mertie@block.mi.th","เชื่อมโยงเทคโนโลยีที่สร้างสรรค์"
"922","Nader Ltd","agustina50@collier.ac.th","ส่งเสริมโครงสร้างอย่างไร้ที่ติ"
"923","Breitenberg Ltd","jaquan.maggio@pollich.com","พัฒนาเนื้อหาคุณภาพสากล"
"924","Kling Ltd","carroll40@cummings.com","สรรสร้างความคิดพร้อมใช้งาน"
"925","Olson Ltd","little.wilton@koelpin.com","เชื่อมโยงอุตสาหกรรมอย่างไร้รอยต่อ"
"926","Hodkiewicz Ltd","ydaniel@rolfson.com","ประสานโครงสร้างพร้อมใช้งาน"
"927","Bogisich Ltd","unique26@mann.ac.th","พัฒนาผู้ใช้อย่างสากล"
"928","Zemlak Ltd","morn@bernier.go.th","เชื่อมโยงประสบการณ์ที่มีคุณค่า"
"929","Watsica Ltd","agleichner@feeney.co.th","เปลี่ยนความคิดที่สร้างสรรค์"
"930","Mayert Ltd","xframi@emard.or.th","สรรสร้างเทคโนโลยีที่มีความหมาย"
"931","Wehner Ltd","ischuppe@moore.co.th","พัฒนาตลาดอย่างมีประสิทธิภาพ"
"932","Schuster Ltd","alfonso.rosenbaum@marks.th","ส่งเสริมสถาปัตยกรรมคุณภาพสากล"
"933","Kris Ltd","tyree.goodwin@jenkins.in.th","ส่งเสริมโครงสร้างสมัยใหม่"
"934","Hahn Ltd","donald92@lockman.co.th","เชื่อมต่อเนื้อหาที่มีความหมาย"
"935","Swift Ltd","parker.zakary@welch.or.th","ประสานผู้ใช้ที่โปร่งใส"
"936","Hudson Ltd","ckoch@murazik.go.th","ส่งเสริมประสบการณ์อย่างไร้รอยต่อ"
"937","Padberg Ltd","xbotsford@conroy.go.th","พัฒนาตลาดที่สร้างสรรค์"
"938","Beer Ltd","vkuvalis@boyer.or.th","พัฒนาความคิดที่มีความหมาย"
"939","Pouros Ltd","oberbrunner.freda@auer.com","พัฒนาเนื้อหาที่มีคุณค่า"
"940","Douglas Ltd","agustin80@moore.com","ส่งเสริมประสบการณ์ที่มีความหมาย"
"941","Stracke Ltd","bthiel@leffler.co.th","เชื่อมต่อระบบอย่างสากล"
"942","Sauer Ltd","nikki85@schmitt.or.th","ส่งเสริมเครือข่ายที่โปร่งใส"
"943","Casper Ltd","hluettgen@koepp.com","เปลี่ยนประสบการณ์ที่สร้างสรรค์"
"944","Quigley Ltd","nils.collins@paucek.com","สรรสร้างเครือข่ายอย่างไร้ที่ติ"
"945","Tillman Ltd","haley.amelie@balistreri.net.th","เชื่อมต่อเทคโนโลยีเพื่อการเปลี่ยนแปลง"
"946","Walter Ltd","yazmin.terry@weber.mi.th","เชื่อมโยงเครือข่ายที่ปรับตัวได้"
"947","White Ltd","casper.lelia@quigley.co.th","เปลี่ยนโครงสร้างเพื่อการเปลี่ยนแปลง"
"948","Jaskolski Ltd","russel.webster@ruecker.ac.th","ประสานโครงสร้างที่น่าดึงดูด"
"949","Franecki Ltd","kylie36@schumm.or.th","เปลี่ยนเครือข่ายอย่างมีประสิทธิภาพ"
"950","Pfeffer Ltd","keaton.wisozk@greenholt.mi.th","พัฒนาตลาดที่มีความหมาย"
"951","Turcotte Ltd","greenholt.deja@robel.com","เปลี่ยนประสบการณ์สู่ผู้บริโภค"
"952","Ferry Ltd","larkin.ladarius@kozey.or.th","สรรสร้างเทคโนโลยีสมัยใหม่"
"953","VonRueden Ltd","huel.berenice@becker.ac.th","เชื่อมโยงตลาดเพื่อการเปลี่ยนแปลง"
"954","Von Ltd","daphney53@gleason.mi.th","เชื่อมต่อเครือข่ายรูปแบบใหม่"
"955","Schowalter Ltd","maggio.dakota@little.go.th","เชื่อมต่อตลาดรูปแบบใหม่"
"956","Harvey Ltd","kaleigh28@sanford.net.th","เปลี่ยนโครงสร้างอย่างมีประสิทธิภาพ"
"957","Sawayn Ltd","nienow.noelia@yundt.go.th","เชื่อมต่อเนื้อหาที่มีความหมาย"
"958","Larson Ltd","hailie.mohr@grant.in.th","เชื่อมต่อเนื้อหา24 ชั่วโมง"
"959","King Ltd","susan.grant@boehm.th","เชื่อมโยงอุตสาหกรรมอย่างมีประสิทธิภาพ"
"960","Cronin Ltd","dickinson.dashawn@reichel.go.th","ส่งเสริมความคิดรูปแบบใหม่"
"961","Spencer Ltd","cassandra66@carroll.in.th","เชื่อมต่อเนื้อหา24 ชั่วโมง"
"962","Grant Ltd","immanuel.thiel@quitzon.in.th","พัฒนาเนื้อหาคุณภาพสากล"
"963","Schaden Ltd","novella23@hodkiewicz.th","สรรสร้างเนื้อหาสู่ผู้บริโภค"
"964","Gislason Ltd","rickey28@bernhard.co.th","เปลี่ยนเนื้อหาอย่างสากล"
"965","Dietrich Ltd","brannon08@raynor.mi.th","พัฒนาตลาดที่ปรับตัวได้"
"966","Ebert Ltd","zbayer@mcglynn.th","ส่งเสริมเนื้อหาสมัยใหม่"
"967","Kuvalis Ltd","zjakubowski@smitham.ac.th","เชื่อมโยงความคิดที่สร้างสรรค์"
"968","Oberbrunner Ltd","fritsch.lucius@gusikowski.com","สรรสร้างผู้ใช้อย่างมีประสิทธิภาพ"
"969","Runte Ltd","mkertzmann@eichmann.mi.th","สรรสร้างโครงสร้างรูปแบบใหม่"
"970","Breitenberg Ltd","idella.moen@veum.ac.th","เปลี่ยนผู้ใช้ที่สร้างสรรค์"
"971","Renner Ltd","ytowne@schamberger.com","ประสานตลาดเพื่อการเปลี่ยนแปลง"
"972","Orn Ltd","johnston.orpha@boyle.in.th","เปลี่ยนอุตสาหกรรมพร้อมใช้งาน"
"973","Swift Ltd","keeling.reginald@wilkinson.or.th","สรรสร้างผู้ใช้อย่างไร้ที่ติ"
"974","Mante Ltd","verner.vonrueden@klein.in.th","เชื่อมต่อเครือข่ายอย่างมีประสิทธิภาพ"
"975","Jerde Ltd","guadalupe12@carroll.go.th","พัฒนาผู้ใช้ที่มีความหมาย"
"976","Kling Ltd","kendall25@ondricka.or.th","เชื่อมโยงเครือข่ายสมัยใหม่"
"977","Harris Ltd","qfritsch@wehner.net.th","พัฒนาโครงสร้างพร้อมใช้งาน"
"978","Leannon Ltd","rmcclure@grimes.com","พัฒนาเครือข่าย24 ชั่วโมง"
"979","Green Ltd","tyrell.olson@dubuque.ac.th","ส่งเสริมเทคโนโลยีอย่างไร้รอยต่อ"
"980","Stoltenberg Ltd","webster.kunde@macejkovic.th","เปลี่ยนเนื้อหาที่มีคุณค่า"
"981","Witting Ltd","xtreutel@wolf.in.th","เปลี่ยนโครงสร้างพร้อมใช้งาน"
"982","Breitenberg Ltd","greenholt.adelbert@schneider.ac.th","เชื่อมโยงโครงสร้างเพื่อการเปลี่ยนแปลง"
"983","Hoppe Ltd","shany.stiedemann@jacobson.or.th","สรรสร้างผู้ใช้24 ชั่วโมง"
"984","Hegmann Ltd","kchamplin@muller.mi.th","เปลี่ยนเนื้อหารูปแบบใหม่"
"985","Schmidt Ltd","jack.ziemann@miller.or.th","เชื่อมต่ออุตสาหกรรมที่น่าดึงดูด"
"986","Huels Ltd","hershel93@gislason.co.th","เชื่อมโยงเนื้อหารูปแบบใหม่"
"987","Hayes Ltd","dmckenzie@pagac.mi.th","สรรสร้างอุตสาหกรรมอย่างสากล"
"988","Greenfelder Ltd","jonathan.lindgren@farrell.th","สรรสร้างสถาปัตยกรรมเพื่อการเปลี่ยนแปลง"
"989","Streich Ltd","tziemann@weissnat.net.th","พัฒนาระบบคุณภาพสากล"
"990","Hoeger Ltd","volkman.breanna@thiel.net.th","เชื่อมโยงเครือข่ายคุณภาพสากล"
"991","Reichel Ltd","cordie.wiegand@lind.in.th","สรรสร้างเทคโนโลยีที่น่าดึงดูด"
