id,fake-company-name,company-email,slogan
"398","Swift Ltd","frieda38@connelly.net.th","สรรสร้างความคิดที่ปรับตัวได้"
"399","Hirthe Ltd","denesik.terrell@lockman.or.th","เชื่อมต่อเทคโนโลยี24 ชั่วโมง"
"400","Emmerich Ltd","pmurray@kerluke.mi.th","เปลี่ยนโครงสร้างที่มีความหมาย"
"401","Mayer Ltd","lvonrueden@hagenes.th","เปลี่ยนตลาดรูปแบบใหม่"
"402","Toy Ltd","mcglynn.fidel@mayer.mi.th","เชื่อมต่อเนื้อหาที่แข็งแกร่ง"
"403","Gleichner Ltd","wkautzer@upton.mi.th","ประสานสถาปัตยกรรมอย่างสากล"
"404","Reynolds Ltd","alda19@stracke.th","ส่งเสริมระบบพร้อมใช้งาน"
"405","Schinner Ltd","shaylee68@dare.th","ส่งเสริมตลาดที่โปร่งใส"
"406","Howe Ltd","brendan26@okon.or.th","ประสานสถาปัตยกรรมที่น่าดึงดูด"
"407","Legros Ltd","sanford.amely@barrows.co.th","ส่งเสริมตลาดอย่างมีประสิทธิภาพ"
"408","Gutmann Ltd","julio.kreiger@hand.in.th","เชื่อมต่อตลาดอย่างไร้ที่ติ"
"409","Gerhold Ltd","debert@wiegand.in.th","เชื่อมต่อระบบที่มีความหมาย"
"410","Skiles Ltd","anderson99@dubuque.net.th","ประสานตลาดเพื่อการเปลี่ยนแปลง"
"411","Gottlieb Ltd","talia11@reynolds.net.th","ส่งเสริมระบบที่น่าดึงดูด"
"412","Spinka Ltd","keanu.ebert@murazik.or.th","ประสานประสบการณ์สมัยใหม่"
"413","Renner Ltd","rogelio.hermann@keeling.in.th","สรรสร้างสถาปัตยกรรมที่ปรับตัวได้"
"414","Kulas Ltd","ima61@olson.co.th","สรรสร้างประสบการณ์คุณภาพสากล"
"415","McDermott Ltd","isaias.fadel@olson.co.th","เชื่อมโยงเนื้อหาพร้อมใช้งาน"
"416","Von Ltd","qondricka@bosco.in.th","สรรสร้างตลาดที่มีคุณค่า"
"417","Lindgren Ltd","swillms@monahan.ac.th","สรรสร้างเนื้อหาที่น่าดึงดูด"
"418","Bernhard Ltd","seth94@marquardt.in.th","ส่งเสริมระบบอย่างมีประสิทธิภาพ"
"419","Kemmer Ltd","willa81@streich.mi.th","เชื่อมโยงระบบที่มีความหมาย"
"420","Lebsack Ltd","issac.torp@lakin.in.th","ส่งเสริมผู้ใช้ที่แข็งแกร่ง"
"421","Ullrich Ltd","swaelchi@muller.net.th","สรรสร้างประสบการณ์อย่างมีประสิทธิภาพ"
"422","Gerhold Ltd","deanna.hickle@casper.ac.th","เชื่อมโยงความคิดพร้อมใช้งาน"
"423","Kozey Ltd","beier.gage@ziemann.mi.th","เปลี่ยนระบบอย่างไร้รอยต่อ"
"424","Beatty Ltd","padberg.alba@rogahn.go.th","ประสานตลาดรูปแบบใหม่"
"425","Baumbach Ltd","emedhurst@smitham.net.th","สรรสร้างสถาปัตยกรรมที่แข็งแกร่ง"
"426","Gottlieb Ltd","angeline.rolfson@rice.go.th","ประสานเทคโนโลยีอย่างไร้ที่ติ"
"427","Mayert Ltd","raymundo.wisoky@goodwin.com","พัฒนาตลาดสู่ผู้บริโภค"
"428","Stanton Ltd","little.raul@wiza.net.th","สรรสร้างสถาปัตยกรรมที่โปร่งใส"
"429","Nader Ltd","bbaumbach@dicki.mi.th","เปลี่ยนประสบการณ์รูปแบบใหม่"
"430","Morissette Ltd","mills.serenity@hoppe.com","สรรสร้างเทคโนโลยีคุณภาพสากล"
"431","Jacobs Ltd","chance.cassin@parker.go.th","พัฒนาตลาดสู่ผู้บริโภค"
"432","Stoltenberg Ltd","lubowitz.lela@cassin.in.th","พัฒนาอุตสาหกรรมอย่างมีประสิทธิภาพ"
"433","Rolfson Ltd","hickle.jazmyn@simonis.or.th","ส่งเสริมสถาปัตยกรรมอย่างไร้รอยต่อ"
"434","Bradtke Ltd","gusikowski.cierra@pacocha.th","สรรสร้างโครงสร้างที่แข็งแกร่ง"
"435","Rohan Ltd","rodriguez.jaydon@smitham.net.th","เปลี่ยนสถาปัตยกรรมที่โปร่งใส"
"436","Marquardt Ltd","aconroy@adams.th","สรรสร้างเนื้อหาอย่างไร้ที่ติ"
"437","Turner Ltd","wiza.buck@hodkiewicz.net.th","เชื่อมโยงเนื้อหาที่มีความหมาย"
"438","Deckow Ltd","xzavier.kunze@skiles.net.th","สรรสร้างประสบการณ์อย่างมีประสิทธิภาพ"
"439","Botsford Ltd","weimann.price@kovacek.mi.th","ประสานระบบที่มีคุณค่า"
"440","Emmerich Ltd","annalise.bartoletti@volkman.go.th","สรรสร้างความคิดที่โปร่งใส"
"441","Trantow Ltd","berge.gabe@jaskolski.ac.th","เชื่อมต่อตลาดรูปแบบใหม่"
"442","Marks Ltd","valentina13@veum.co.th","ประสานสถาปัตยกรรมสู่ผู้บริโภค"
"443","Predovic Ltd","domenico.howe@reynolds.ac.th","ประสานเทคโนโลยีอย่างไร้ที่ติ"
"444","Harris Ltd","dbahringer@kuphal.in.th","ส่งเสริมระบบ24 ชั่วโมง"
"445","Stanton Ltd","minnie49@spinka.mi.th","พัฒนาเนื้อหาอย่างไร้รอยต่อ"
"446","Brakus Ltd","dietrich.cassidy@mccullough.ac.th","เปลี่ยนเนื้อหาเพื่อการเปลี่ยนแปลง"
"447","Lubowitz Ltd","glenna47@block.or.th","เปลี่ยนประสบการณ์ที่มีคุณค่า"
"448","Ebert Ltd","oran.leannon@blick.go.th","สรรสร้างระบบที่มีความหมาย"
"449","Stokes Ltd","eliseo.rau@bechtelar.co.th","พัฒนาตลาดสมัยใหม่"
"450","Goyette Ltd","okeefe.coralie@hill.ac.th","พัฒนาผู้ใช้พร้อมใช้งาน"
"451","Emard Ltd","mcdermott.hyman@larkin.mi.th","เชื่อมโยงผู้ใช้ที่มีคุณค่า"
"452","O'Keefe Ltd","maurine.torphy@stamm.mi.th","เปลี่ยนระบบ24 ชั่วโมง"
"453","Beahan Ltd","elton18@wyman.net.th","สรรสร้างผู้ใช้เพื่อการเปลี่ยนแปลง"
"454","Baumbach Ltd","kaylie75@haley.co.th","พัฒนาอุตสาหกรรมที่แข็งแกร่ง"
"455","Hills Ltd","ashley91@bashirian.mi.th","พัฒนาผู้ใช้คุณภาพสากล"
"456","Pfeffer Ltd","kroob@gusikowski.or.th","ประสานเทคโนโลยีรูปแบบใหม่"
"457","Langosh Ltd","qboyer@heller.go.th","เปลี่ยนสถาปัตยกรรมที่มีความหมาย"
"458","West Ltd","greyson28@moen.th","พัฒนาเทคโนโลยีพร้อมใช้งาน"
"459","Schaefer Ltd","emmalee.prohaska@osinski.th","เปลี่ยนอุตสาหกรรมรูปแบบใหม่"
"460","Crist Ltd","wiegand.lelia@bins.com","เชื่อมโยงสถาปัตยกรรมที่แข็งแกร่ง"
"461","Murazik Ltd","ramona54@lang.net.th","ส่งเสริมผู้ใช้ที่น่าดึงดูด"
"462","Mohr Ltd","vernice11@quigley.in.th","สรรสร้างผู้ใช้อย่างสากล"
"463","Bernhard Ltd","dewayne.goyette@tillman.mi.th","พัฒนาความคิดรูปแบบใหม่"
"464","Lemke Ltd","bradley.mills@heathcote.th","ประสานผู้ใช้ที่โปร่งใส"
"465","Beier Ltd","astrid.baumbach@bartoletti.or.th","สรรสร้างความคิดพร้อมใช้งาน"
"466","Abbott Ltd","lhansen@fisher.ac.th","พัฒนาความคิดที่สร้างสรรค์"
"467","Shields Ltd","sally.murphy@ohara.mi.th","ส่งเสริมโครงสร้างที่น่าดึงดูด"
"468","Stehr Ltd","cmccullough@bartell.ac.th","เปลี่ยนตลาดที่โปร่งใส"
"469","Wiegand Ltd","ghansen@ernser.or.th","เปลี่ยนเนื้อหาที่มีคุณค่า"
"470","Homenick Ltd","leann.abshire@blick.th","เปลี่ยนเนื้อหา24 ชั่วโมง"
"471","White Ltd","letha.tromp@jaskolski.ac.th","เปลี่ยนประสบการณ์อย่างสากล"
"472","Gerlach Ltd","braxton46@koepp.or.th","เปลี่ยนสถาปัตยกรรมที่แข็งแกร่ง"
"473","Powlowski Ltd","bhuels@bernhard.or.th","เชื่อมโยงเทคโนโลยีที่สร้างสรรค์"
"474","Larkin Ltd","gerlach.yoshiko@stark.net.th","เชื่อมโยงเนื้อหาที่สร้างสรรค์"
"475","Gleason Ltd","will.zander@klein.net.th","เชื่อมต่อเนื้อหาที่แข็งแกร่ง"
"476","Bogan Ltd","dooley.shaina@batz.th","เชื่อมต่อเทคโนโลยีที่มีความหมาย"
"477","Cummings Ltd","payton76@heaney.go.th","พัฒนาเครือข่ายอย่างสากล"
"478","Rogahn Ltd","dwight.turcotte@heidenreich.in.th","สรรสร้างความคิดที่ปรับตัวได้"
"479","Klocko Ltd","okeefe.darius@armstrong.ac.th","ประสานประสบการณ์เพื่อการเปลี่ยนแปลง"
"480","Stamm Ltd","tobin64@gorczany.go.th","เปลี่ยนประสบการณ์ที่มีคุณค่า"
"481","Wisozk Ltd","donny.metz@vonrueden.com","ประสานเครือข่ายอย่างไร้ที่ติ"
"482","Zulauf Ltd","jordy25@leannon.in.th","เปลี่ยนโครงสร้างสู่ผู้บริโภค"
"483","Thiel Ltd","koepp.cara@cruickshank.in.th","ส่งเสริมตลาดที่ปรับตัวได้"
"484","Barrows Ltd","eryn.miller@hoppe.go.th","ประสานตลาดที่มีคุณค่า"
"485","Bahringer Ltd","barrett85@lang.com","ส่งเสริมความคิดที่สร้างสรรค์"
"486","Rice Ltd","karl69@turcotte.go.th","เชื่อมโยงเทคโนโลยีรูปแบบใหม่"
"487","Roob Ltd","kzboncak@swift.go.th","เชื่อมต่อโครงสร้างที่สร้างสรรค์"
"488","Howe Ltd","keara.aufderhar@schuster.co.th","สรรสร้างเทคโนโลยีอย่างมีประสิทธิภาพ"
"489","Wolf Ltd","beier.joyce@buckridge.mi.th","พัฒนาตลาดที่โปร่งใส"
"490","Rohan Ltd","mbrown@haag.go.th","เปลี่ยนเครือข่ายที่น่าดึงดูด"
"491","Leffler Ltd","mattie.orn@kilback.or.th","เชื่อมต่อสถาปัตยกรรมสู่ผู้บริโภค"
"492","Bradtke Ltd","rose05@veum.ac.th","ส่งเสริมโครงสร้างรูปแบบใหม่"
"493","Davis Ltd","cleta.douglas@hodkiewicz.ac.th","ส่งเสริมสถาปัตยกรรมสู่ผู้บริโภค"
"494","Towne Ltd","ukiehn@champlin.co.th","ประสานเครือข่ายสู่ผู้บริโภค"
"495","Feest Ltd","valentina31@langosh.net.th","พัฒนาตลาดรูปแบบใหม่"
"496","Cremin Ltd","runolfsson.halie@douglas.go.th","ส่งเสริมเทคโนโลยีอย่างมีประสิทธิภาพ"
"497","Lakin Ltd","ycartwright@leffler.ac.th","พัฒนาเนื้อหาที่แข็งแกร่ง"
"498","D'Amore Ltd","clair.deckow@graham.th","ส่งเสริมประสบการณ์รูปแบบใหม่"
"499","Armstrong Ltd","trystan96@larkin.go.th","เชื่อมโยงผู้ใช้อย่างมีประสิทธิภาพ"
"500","Fadel Ltd","virgil.schoen@lindgren.net.th","ประสานระบบสู่ผู้บริโภค"
"501","Murray Ltd","champlin.mikel@zulauf.mi.th","เชื่อมโยงสถาปัตยกรรมอย่างสากล"
"502","Stark Ltd","beth41@stamm.com","เปลี่ยนอุตสาหกรรมที่มีความหมาย"
"503","Kreiger Ltd","cordelia51@tromp.or.th","เชื่อมต่อเครือข่ายที่สร้างสรรค์"
"504","Gusikowski Ltd","mclaughlin.kameron@hyatt.go.th","ส่งเสริมเทคโนโลยีที่โปร่งใส"
"505","Walter Ltd","stehr.josephine@prosacco.co.th","สรรสร้างระบบอย่างสากล"
"506","Beatty Ltd","esteban37@gottlieb.in.th","สรรสร้างอุตสาหกรรมอย่างสากล"
"507","Schowalter Ltd","kayla81@wehner.th","เปลี่ยนโครงสร้างที่น่าดึงดูด"
"508","Kuvalis Ltd","zprice@klein.com","เชื่อมโยงอุตสาหกรรม24 ชั่วโมง"
"509","Nienow Ltd","eschuppe@franecki.com","ส่งเสริมอุตสาหกรรมที่โปร่งใส"
"510","Gaylord Ltd","tony43@roberts.com","ประสานโครงสร้างที่น่าดึงดูด"
"511","Schamberger Ltd","herzog.clarissa@borer.th","เชื่อมต่ออุตสาหกรรมสมัยใหม่"
"512","Hoppe Ltd","neil.wilderman@ortiz.com","พัฒนาเนื้อหาที่มีคุณค่า"
"513","Wolff Ltd","juliet08@leuschke.net.th","ส่งเสริมเทคโนโลยีคุณภาพสากล"
"514","Harvey Ltd","myah70@lebsack.mi.th","สรรสร้างระบบรูปแบบใหม่"
"515","Little Ltd","white.wendell@dickens.com","เปลี่ยนประสบการณ์คุณภาพสากล"
"516","Crooks Ltd","foster36@sporer.or.th","สรรสร้างประสบการณ์ที่แข็งแกร่ง"
"517","Thompson Ltd","marvin.leonard@kautzer.co.th","เปลี่ยนเนื้อหาอย่างไร้รอยต่อ"
"518","Bins Ltd","mkessler@homenick.in.th","ส่งเสริมตลาดที่มีความหมาย"
"519","Durgan Ltd","lorenz65@streich.th","ส่งเสริมอุตสาหกรรมอย่างมีประสิทธิภาพ"
"520","Lakin Ltd","braun.otha@shanahan.ac.th","เปลี่ยนความคิดที่น่าดึงดูด"
"521","Howe Ltd","dorian.brown@vonrueden.net.th","เชื่อมต่อเทคโนโลยีอย่างไร้ที่ติ"
"522","Marquardt Ltd","vstark@hane.mi.th","เปลี่ยนความคิดที่โปร่งใส"
"523","Nolan Ltd","casper.aurelie@waters.mi.th","เชื่อมโยงโครงสร้างสมัยใหม่"
"524","Oberbrunner Ltd","lwalter@stokes.ac.th","พัฒนาโครงสร้างเพื่อการเปลี่ยนแปลง"
"525","Fadel Ltd","izieme@harris.ac.th","ส่งเสริมเนื้อหาอย่างไร้รอยต่อ"
"526","Schuster Ltd","scotty.fisher@gusikowski.net.th","สรรสร้างเทคโนโลยีพร้อมใช้งาน"
"527","Marquardt Ltd","farrell.fritz@wilkinson.mi.th","ส่งเสริมความคิดรูปแบบใหม่"
"528","Reichert Ltd","fbalistreri@kilback.com","ประสานเครือข่ายอย่างสากล"
"529","Aufderhar Ltd","ggreenholt@larson.mi.th","เชื่อมต่ออุตสาหกรรม24 ชั่วโมง"
"530","McDermott Ltd","wolf.onie@wunsch.com","เชื่อมต่อประสบการณ์เพื่อการเปลี่ยนแปลง"
"531","Padberg Ltd","janelle.huels@mcdermott.in.th","เปลี่ยนสถาปัตยกรรมที่โปร่งใส"
"532","Kirlin Ltd","frances70@schuster.co.th","สรรสร้างระบบที่ปรับตัวได้"
"533","Feest Ltd","martine.powlowski@hauck.net.th","เชื่อมโยงอุตสาหกรรมที่มีความหมาย"
"534","Stiedemann Ltd","isabella.carroll@shanahan.mi.th","เปลี่ยนประสบการณ์อย่างไร้รอยต่อ"
"535","Predovic Ltd","van66@mcdermott.go.th","เชื่อมต่อผู้ใช้ที่สร้างสรรค์"
"536","Lebsack Ltd","terry.lelia@goodwin.com","พัฒนาเทคโนโลยีที่แข็งแกร่ง"
"537","Boyle Ltd","obie.stark@kunze.net.th","ประสานผู้ใช้รูปแบบใหม่"
"538","Walter Ltd","tschaden@adams.go.th","เปลี่ยนประสบการณ์รูปแบบใหม่"
"539","Schulist Ltd","alvena19@thiel.in.th","เชื่อมต่อสถาปัตยกรรมพร้อมใช้งาน"
"540","Kautzer Ltd","donnie76@deckow.or.th","ส่งเสริมความคิดที่มีคุณค่า"
"541","Hamill Ltd","jazmyn.williamson@ledner.mi.th","พัฒนาตลาดที่มีความหมาย"
"542","Berge Ltd","nienow.clifton@casper.ac.th","ส่งเสริมโครงสร้างอย่างสากล"
"543","Hayes Ltd","cormier.citlalli@abbott.mi.th","สรรสร้างอุตสาหกรรมอย่างมีประสิทธิภาพ"
"544","Hintz Ltd","chandler.davis@johns.ac.th","เปลี่ยนโครงสร้างที่สร้างสรรค์"
"545","Mueller Ltd","uchamplin@bergstrom.com","เชื่อมต่อระบบที่สร้างสรรค์"
"546","Dare Ltd","toy.marjorie@dubuque.th","เปลี่ยนเทคโนโลยีที่น่าดึงดูด"
"547","Brakus Ltd","yost.missouri@fahey.com","เปลี่ยนตลาดอย่างมีประสิทธิภาพ"
"548","Stroman Ltd","batz.roberta@russel.com","เชื่อมต่อโครงสร้าง24 ชั่วโมง"
"549","Purdy Ltd","willow35@heaney.net.th","เปลี่ยนตลาดที่สร้างสรรค์"
"550","Waelchi Ltd","hcrooks@cartwright.com","เชื่อมต่อเครือข่ายที่มีความหมาย"
"551","Gutkowski Ltd","stroman.heaven@daniel.or.th","เชื่อมโยงเนื้อหาเพื่อการเปลี่ยนแปลง"
"552","Turner Ltd","welch.carolyn@hauck.ac.th","เชื่อมโยงเนื้อหาเพื่อการเปลี่ยนแปลง"
"553","Wehner Ltd","adolph95@braun.ac.th","ประสานโครงสร้างที่แข็งแกร่ง"
"554","Jerde Ltd","priscilla13@hill.net.th","ส่งเสริมตลาดอย่างไร้รอยต่อ"
"555","Buckridge Ltd","mckenzie.rick@lubowitz.com","พัฒนาความคิดที่มีความหมาย"
"556","Zemlak Ltd","orn.jalen@langosh.net.th","เปลี่ยนความคิดที่ปรับตัวได้"
"557","Turcotte Ltd","flo.mraz@abernathy.com","เปลี่ยนเครือข่ายที่น่าดึงดูด"
"558","Muller Ltd","witting.johan@goyette.go.th","ประสานโครงสร้างที่สร้างสรรค์"
"559","Metz Ltd","ledner.wade@leuschke.co.th","สรรสร้างเทคโนโลยีที่มีคุณค่า"
"560","Bartoletti Ltd","jacques.funk@wolf.mi.th","เชื่อมต่อเทคโนโลยีพร้อมใช้งาน"
"561","Reynolds Ltd","terry.florence@kunze.net.th","สรรสร้างสถาปัตยกรรมสมัยใหม่"
"562","Anderson Ltd","antonietta.rutherford@keebler.net.th","เชื่อมโยงเครือข่าย24 ชั่วโมง"
"563","Mills Ltd","dallas.mccullough@rohan.ac.th","สรรสร้างเทคโนโลยีที่แข็งแกร่ง"
"564","Tromp Ltd","hwolf@schaefer.or.th","ประสานตลาดอย่างมีประสิทธิภาพ"
"565","Langworth Ltd","qbarton@rutherford.net.th","เชื่อมโยงโครงสร้างอย่างมีประสิทธิภาพ"
"566","Dietrich Ltd","adrian.upton@mayert.mi.th","เชื่อมโยงเทคโนโลยีที่โปร่งใส"
"567","Zemlak Ltd","okuneva.paolo@pfeffer.co.th","พัฒนาสถาปัตยกรรมที่โปร่งใส"
"568","Zboncak Ltd","lulu.schultz@beier.com","ส่งเสริมสถาปัตยกรรมสู่ผู้บริโภค"
"569","Zemlak Ltd","lempi.oberbrunner@murray.com","ประสานเนื้อหาสู่ผู้บริโภค"
"570","Maggio Ltd","jeanie01@okuneva.net.th","เปลี่ยนอุตสาหกรรมอย่างไร้ที่ติ"
"571","Gleichner Ltd","eadams@jakubowski.go.th","เปลี่ยนเทคโนโลยีที่น่าดึงดูด"
"572","Herzog Ltd","halie07@gottlieb.or.th","เชื่อมโยงสถาปัตยกรรมรูปแบบใหม่"
"573","Macejkovic Ltd","bogan.adaline@ohara.th","ประสานเครือข่ายที่โปร่งใส"
"574","Friesen Ltd","friesen.myrtie@cassin.go.th","ส่งเสริมผู้ใช้ที่โปร่งใส"
"575","O'Reilly Ltd","sandrine.trantow@stokes.net.th","พัฒนาเครือข่าย24 ชั่วโมง"
"576","O'Connell Ltd","yvette.bergstrom@bashirian.mi.th","เชื่อมโยงระบบสมัยใหม่"
"577","O'Kon Ltd","ibrown@champlin.com","ส่งเสริมผู้ใช้ที่มีความหมาย"
"578","Conroy Ltd","renee.hamill@ratke.in.th","สรรสร้างโครงสร้างรูปแบบใหม่"
"579","Gleichner Ltd","ekautzer@donnelly.or.th","เชื่อมโยงระบบอย่างสากล"
"580","Schuppe Ltd","marianne.windler@schroeder.mi.th","ประสานประสบการณ์รูปแบบใหม่"
"581","Kuhic Ltd","michel24@goyette.net.th","เชื่อมต่อระบบอย่างมีประสิทธิภาพ"
"582","Adams Ltd","larkin.tianna@robel.mi.th","สรรสร้างระบบคุณภาพสากล"
"583","Schneider Ltd","dortiz@oconner.in.th","เชื่อมโยงตลาด24 ชั่วโมง"
"584","Raynor Ltd","chloe.runolfsdottir@fisher.or.th","เชื่อมโยงประสบการณ์24 ชั่วโมง"
"585","Beier Ltd","fluettgen@grady.in.th","ส่งเสริมประสบการณ์อย่างมีประสิทธิภาพ"
"586","Hettinger Ltd","ikessler@mccullough.net.th","สรรสร้างผู้ใช้สมัยใหม่"
"587","Tremblay Ltd","skoch@schaden.or.th","ประสานเทคโนโลยีที่น่าดึงดูด"
"588","Donnelly Ltd","dakota.berge@bogan.go.th","เปลี่ยนเนื้อหาสมัยใหม่"
"589","Cronin Ltd","ryan.madison@homenick.net.th","ประสานประสบการณ์สมัยใหม่"
"590","Cruickshank Ltd","ivy.herzog@kirlin.th","เชื่อมโยงตลาดที่มีคุณค่า"
"591","Cassin Ltd","marcelino.nikolaus@bergnaum.ac.th","เชื่อมต่อประสบการณ์รูปแบบใหม่"
"592","Kunze Ltd","hans17@moen.com","เชื่อมต่อตลาดที่มีความหมาย"
"593","Kunde Ltd","hbins@hartmann.th","ส่งเสริมเทคโนโลยีคุณภาพสากล"
"594","Larson Ltd","vwilderman@ebert.net.th","พัฒนาผู้ใช้ที่แข็งแกร่ง"
"595","Fahey Ltd","nienow.douglas@fritsch.co.th","เปลี่ยนระบบที่แข็งแกร่ง"
