id,fake-company-name,company-email,slogan
"1","O'Keefe Ltd","jacobs.brain@veum.com","ประสานตลาดสมัยใหม่"
"2","Casper Ltd","eriberto43@strosin.ac.th","ส่งเสริมประสบการณ์สมัยใหม่"
"3","Friesen Ltd","robel.dedrick@blick.ac.th","เชื่อมโยงอุตสาหกรรมพร้อมใช้งาน"
"4","Heathcote Ltd","tvolkman@botsford.com","สรรสร้างสถาปัตยกรรมอย่างมีประสิทธิภาพ"
"5","Cronin Ltd","pshanahan@marquardt.ac.th","เชื่อมต่อระบบสู่ผู้บริโภค"
"6","Nader Ltd","rmurray@vonrueden.in.th","ประสานโครงสร้าง24 ชั่วโมง"
"7","Mayert Ltd","greenholt.justice@swift.ac.th","ส่งเสริมเนื้อหา24 ชั่วโมง"
"8","Huels Ltd","agnes41@towne.co.th","สรรสร้างประสบการณ์เพื่อการเปลี่ยนแปลง"
"9","Powlowski Ltd","schamberger.rachel@lubowitz.in.th","พัฒนาเนื้อหาพร้อมใช้งาน"
"10","Connelly Ltd","cordia.keebler@leuschke.go.th","พัฒนาผู้ใช้24 ชั่วโมง"
"11","Heidenreich Ltd","alessia.rice@witting.go.th","พัฒนาเนื้อหาที่ปรับตัวได้"
"12","Schneider Ltd","karlie09@murazik.com","เชื่อมโยงเทคโนโลยีพร้อมใช้งาน"
"13","Robel Ltd","danielle17@johns.in.th","เชื่อมโยงผู้ใช้ที่โปร่งใส"
"14","Leannon Ltd","gokon@bins.mi.th","ประสานความคิดพร้อมใช้งาน"
"15","Graham Ltd","turcotte.danika@orn.th","ประสานสถาปัตยกรรมอย่างสากล"
"16","Schimmel Ltd","rose27@ernser.mi.th","ส่งเสริมผู้ใช้ที่ปรับตัวได้"
"17","Skiles Ltd","sarai75@renner.co.th","ส่งเสริมสถาปัตยกรรมที่มีคุณค่า"
"18","Medhurst Ltd","pkilback@schinner.ac.th","พัฒนาความคิดที่โปร่งใส"
"19","Turcotte Ltd","boyer.viva@yundt.co.th","เชื่อมต่อโครงสร้างอย่างไร้ที่ติ"
"20","DuBuque Ltd","alessandro.koelpin@cronin.or.th","ส่งเสริมสถาปัตยกรรมที่น่าดึงดูด"
"21","Spinka Ltd","cristina06@marks.mi.th","เปลี่ยนเทคโนโลยีรูปแบบใหม่"
"22","Lockman Ltd","luigi97@dach.mi.th","เชื่อมโยงความคิดพร้อมใช้งาน"
"23","Shanahan Ltd","dashawn26@wolff.go.th","ส่งเสริมประสบการณ์อย่างสากล"
"24","Dicki Ltd","hbashirian@roob.mi.th","เปลี่ยนประสบการณ์ที่มีความหมาย"
"25","Kihn Ltd","qparisian@spinka.co.th","เชื่อมต่อสถาปัตยกรรมที่สร้างสรรค์"
"26","Graham Ltd","jennyfer53@toy.in.th","เชื่อมต่อความคิดคุณภาพสากล"
"27","Beier Ltd","max.legros@botsford.or.th","สรรสร้างตลาดที่ปรับตัวได้"
"28","Tillman Ltd","rmueller@wilderman.co.th","สรรสร้างตลาดคุณภาพสากล"
"29","Cronin Ltd","neil52@heaney.co.th","พัฒนาผู้ใช้ที่มีความหมาย"
"30","Larkin Ltd","charity.stoltenberg@ledner.mi.th","เชื่อมโยงโครงสร้างที่น่าดึงดูด"
"31","Cassin Ltd","orpha.lindgren@barrows.net.th","ส่งเสริมผู้ใช้ที่สร้างสรรค์"
"32","Hickle Ltd","bertrand88@zboncak.th","ประสานความคิดอย่างสากล"
"33","Cole Ltd","mireya97@watsica.net.th","พัฒนาอุตสาหกรรมเพื่อการเปลี่ยนแปลง"
"34","Trantow Ltd","matteo32@kiehn.or.th","เปลี่ยนความคิดอย่างไร้ที่ติ"
"35","Haag Ltd","davis.jerald@gibson.net.th","เชื่อมต่ออุตสาหกรรมที่ปรับตัวได้"
"36","Kuhn Ltd","carroll.jessyca@buckridge.net.th","พัฒนาความคิดที่ปรับตัวได้"
"37","Walter Ltd","amanda64@hintz.in.th","ส่งเสริมตลาดที่โปร่งใส"
"38","Thiel Ltd","quitzon.alexandro@marvin.go.th","สรรสร้างสถาปัตยกรรมพร้อมใช้งาน"
"39","Labadie Ltd","chaya81@braun.ac.th","เปลี่ยนเครือข่ายอย่างมีประสิทธิภาพ"
"40","Legros Ltd","danial47@mertz.go.th","ประสานสถาปัตยกรรมที่มีความหมาย"
"41","Grant Ltd","lharber@waelchi.in.th","สรรสร้างสถาปัตยกรรมที่น่าดึงดูด"
"42","Dietrich Ltd","layla57@konopelski.th","เปลี่ยนระบบที่ปรับตัวได้"
"43","Waters Ltd","blaise.mcdermott@braun.go.th","พัฒนาสถาปัตยกรรมที่ปรับตัวได้"
"44","Wintheiser Ltd","ratke.hilton@sanford.or.th","เปลี่ยนผู้ใช้อย่างมีประสิทธิภาพ"
"45","Schmeler Ltd","rbailey@keeling.in.th","พัฒนาเครือข่ายที่มีความหมาย"
"46","Armstrong Ltd","annabel89@fritsch.or.th","เชื่อมโยงความคิดที่แข็งแกร่ง"
"47","Leuschke Ltd","tianna.sipes@purdy.co.th","ส่งเสริมผู้ใช้ที่สร้างสรรค์"
"48","Hayes Ltd","antone.keebler@lubowitz.ac.th","เชื่อมโยงสถาปัตยกรรมอย่างมีประสิทธิภาพ"
"49","Gusikowski Ltd","ila.kunze@mohr.ac.th","พัฒนาโครงสร้างเพื่อการเปลี่ยนแปลง"
"50","Tillman Ltd","micheal06@cartwright.com","เชื่อมโยงระบบสู่ผู้บริโภค"
"51","McDermott Ltd","augustus.rau@steuber.or.th","ประสานเนื้อหาอย่างไร้รอยต่อ"
"52","Brown Ltd","markus72@feeney.co.th","ส่งเสริมผู้ใช้คุณภาพสากล"
"53","Baumbach Ltd","fkoepp@feeney.go.th","ประสานเทคโนโลยี24 ชั่วโมง"
"54","Waelchi Ltd","zkunze@denesik.th","เชื่อมโยงความคิดอย่างไร้รอยต่อ"
"55","Lakin Ltd","bogisich.carlo@stracke.th","พัฒนาโครงสร้างสู่ผู้บริโภค"
"56","Runolfsson Ltd","rosamond.lang@ortiz.or.th","เปลี่ยนความคิดที่ปรับตัวได้"
"57","Torp Ltd","bechtelar.nathanael@schroeder.in.th","ประสานเครือข่าย24 ชั่วโมง"
"58","Skiles Ltd","bogisich.merritt@kutch.net.th","สรรสร้างโครงสร้างที่ปรับตัวได้"
"59","Cruickshank Ltd","delphine63@miller.in.th","เชื่อมต่อประสบการณ์สู่ผู้บริโภค"
"60","Witting Ltd","nat82@dubuque.in.th","ส่งเสริมเนื้อหาคุณภาพสากล"
"61","Kling Ltd","karolann02@luettgen.ac.th","ประสานตลาดที่ปรับตัวได้"
"62","Kemmer Ltd","zrolfson@kling.net.th","ส่งเสริมโครงสร้างสมัยใหม่"
"63","Schmeler Ltd","gbatz@armstrong.mi.th","สรรสร้างอุตสาหกรรม24 ชั่วโมง"
"64","Ruecker Ltd","brandyn24@wunsch.com","เปลี่ยนเนื้อหาอย่างไร้ที่ติ"
"65","Torp Ltd","fdeckow@jast.or.th","สรรสร้างตลาดที่โปร่งใส"
"66","Bernhard Ltd","odessa.halvorson@stiedemann.ac.th","เชื่อมต่อความคิดรูปแบบใหม่"
"67","Howell Ltd","btremblay@kutch.mi.th","เปลี่ยนประสบการณ์คุณภาพสากล"
"68","Pagac Ltd","gavin.considine@kiehn.in.th","เชื่อมต่อความคิดพร้อมใช้งาน"
"69","Hilpert Ltd","amelia.jacobson@sauer.ac.th","เชื่อมต่อโครงสร้างที่แข็งแกร่ง"
"70","Bogan Ltd","erwin.greenholt@barton.go.th","สรรสร้างความคิดที่โปร่งใส"
"71","Rutherford Ltd","kasey74@spinka.go.th","เชื่อมโยงสถาปัตยกรรมรูปแบบใหม่"
"72","Farrell Ltd","metz.ariel@jerde.in.th","เปลี่ยนประสบการณ์ที่มีความหมาย"
"73","McLaughlin Ltd","ephraim33@mraz.mi.th","พัฒนาเนื้อหาที่แข็งแกร่ง"
"74","Gibson Ltd","dabbott@emard.go.th","เชื่อมต่อประสบการณ์อย่างไร้ที่ติ"
"75","O'Hara Ltd","mlowe@hudson.or.th","สรรสร้างโครงสร้างเพื่อการเปลี่ยนแปลง"
"76","Towne Ltd","hoyt.boehm@berge.co.th","พัฒนาเนื้อหาที่มีคุณค่า"
"77","Bruen Ltd","vonrueden.jefferey@hyatt.mi.th","เชื่อมโยงตลาดที่แข็งแกร่ง"
"78","Berge Ltd","pweimann@blick.co.th","เปลี่ยนผู้ใช้เพื่อการเปลี่ยนแปลง"
"79","Brekke Ltd","yschmidt@metz.mi.th","ส่งเสริมตลาดอย่างไร้รอยต่อ"
"80","Buckridge Ltd","fjohnson@king.com","ประสานเนื้อหาที่สร้างสรรค์"
"81","West Ltd","justus12@heathcote.th","เชื่อมต่อเนื้อหาที่มีความหมาย"
"82","Bartoletti Ltd","ignatius58@hand.co.th","เปลี่ยนโครงสร้างอย่างไร้ที่ติ"
"83","Lebsack Ltd","peyton.herman@williamson.com","ประสานความคิดอย่างสากล"
"84","Ward Ltd","hhuels@wolff.mi.th","ประสานเนื้อหาอย่างสากล"
"85","Collier Ltd","marie60@fisher.th","เชื่อมโยงโครงสร้างที่ปรับตัวได้"
"86","Willms Ltd","gertrude.zieme@bayer.go.th","เชื่อมต่อเทคโนโลยีที่มีคุณค่า"
"87","Kris Ltd","zelda.marquardt@sanford.ac.th","เชื่อมต่อสถาปัตยกรรมรูปแบบใหม่"
"88","Donnelly Ltd","napoleon.wilderman@runolfsdottir.com","ส่งเสริมเนื้อหา24 ชั่วโมง"
"89","D'Amore Ltd","bhansen@windler.go.th","เชื่อมโยงผู้ใช้สมัยใหม่"
"90","Kuphal Ltd","wgoodwin@anderson.com","ประสานเนื้อหาอย่างมีประสิทธิภาพ"
"91","Kiehn Ltd","alexanne70@welch.net.th","เชื่อมต่อประสบการณ์ที่มีคุณค่า"
"92","Stehr Ltd","philip.konopelski@hegmann.go.th","เปลี่ยนเครือข่ายอย่างสากล"
"93","Abernathy Ltd","vance90@borer.th","เปลี่ยนประสบการณ์ที่มีคุณค่า"
"94","Sanford Ltd","rfranecki@adams.ac.th","พัฒนาเนื้อหาอย่างมีประสิทธิภาพ"
"95","Stroman Ltd","lemke.yasmine@romaguera.ac.th","เชื่อมโยงโครงสร้างอย่างสากล"
"96","Conroy Ltd","vandervort.winfield@kuhlman.net.th","เชื่อมต่อผู้ใช้อย่างไร้รอยต่อ"
"97","Funk Ltd","harmon.becker@dooley.in.th","พัฒนาความคิดที่โปร่งใส"
"98","Greenholt Ltd","lstanton@von.net.th","ส่งเสริมผู้ใช้ที่น่าดึงดูด"
"99","Smith Ltd","tyra.bernier@torp.mi.th","เปลี่ยนความคิดพร้อมใช้งาน"
"100","Corkery Ltd","mariah40@okon.mi.th","สรรสร้างผู้ใช้อย่างไร้ที่ติ"
"101","Mayer Ltd","tristin.hodkiewicz@schumm.com","เปลี่ยนผู้ใช้สมัยใหม่"
"102","Rosenbaum Ltd","schmidt.marisa@hackett.com","เชื่อมโยงระบบที่ปรับตัวได้"
"103","Steuber Ltd","zulauf.elsa@luettgen.go.th","สรรสร้างโครงสร้างที่มีคุณค่า"
"104","Crooks Ltd","cwiegand@sauer.net.th","เปลี่ยนระบบที่น่าดึงดูด"
"105","Jacobi Ltd","ebba10@yost.ac.th","เปลี่ยนผู้ใช้24 ชั่วโมง"
"106","Wolff Ltd","bernhard.lucius@mcclure.go.th","ประสานตลาดรูปแบบใหม่"
"107","Rau Ltd","pcartwright@breitenberg.mi.th","ประสานผู้ใช้สู่ผู้บริโภค"
"108","Nolan Ltd","skozey@adams.net.th","เชื่อมต่อเทคโนโลยีสมัยใหม่"
"109","Olson Ltd","edna.fadel@cummings.com","เชื่อมต่อระบบที่มีคุณค่า"
"110","Schroeder Ltd","ashley.moore@thompson.or.th","ส่งเสริมระบบอย่างมีประสิทธิภาพ"
"111","Fisher Ltd","dudley.halvorson@kuvalis.co.th","เปลี่ยนโครงสร้างที่มีความหมาย"
"112","Rath Ltd","cschamberger@auer.in.th","เชื่อมต่อเนื้อหาที่โปร่งใส"
"113","Ankunding Ltd","norn@kerluke.th","เปลี่ยนตลาดคุณภาพสากล"
"114","Considine Ltd","stephania.buckridge@klocko.or.th","พัฒนาเทคโนโลยีที่มีความหมาย"
"115","Rath Ltd","damore.bianka@oberbrunner.ac.th","พัฒนาตลาด24 ชั่วโมง"
"116","Collins Ltd","hector.hane@leffler.ac.th","สรรสร้างอุตสาหกรรมรูปแบบใหม่"
"117","Abbott Ltd","anya.kreiger@nitzsche.mi.th","เชื่อมต่อโครงสร้างที่ปรับตัวได้"
"118","O'Connell Ltd","alivia.kihn@swaniawski.or.th","เชื่อมต่อประสบการณ์อย่างมีประสิทธิภาพ"
"119","Batz Ltd","ahuel@oconner.or.th","เปลี่ยนประสบการณ์ที่มีคุณค่า"
"120","Gaylord Ltd","uferry@homenick.mi.th","เชื่อมต่อเทคโนโลยีที่มีความหมาย"
"121","Considine Ltd","cornelius.shanahan@strosin.in.th","ประสานตลาดสมัยใหม่"
"122","Nader Ltd","lew.corwin@jakubowski.or.th","เปลี่ยนอุตสาหกรรมที่โปร่งใส"
"123","Kuhn Ltd","armstrong.robb@harris.ac.th","ประสานตลาด24 ชั่วโมง"
"124","Champlin Ltd","pprice@greenholt.mi.th","ส่งเสริมเทคโนโลยีรูปแบบใหม่"
"125","Deckow Ltd","mustafa.mcclure@ruecker.or.th","สรรสร้างประสบการณ์ที่สร้างสรรค์"
"126","Lockman Ltd","klein.reba@okon.net.th","เชื่อมต่อประสบการณ์รูปแบบใหม่"
"127","Wuckert Ltd","kabernathy@koss.co.th","ส่งเสริมความคิดที่น่าดึงดูด"
"128","Nienow Ltd","benedict99@stoltenberg.in.th","เชื่อมต่อระบบอย่างมีประสิทธิภาพ"
"129","Price Ltd","moore.rey@schowalter.com","เปลี่ยนเครือข่ายเพื่อการเปลี่ยนแปลง"
"130","Emard Ltd","zelda18@hyatt.net.th","เชื่อมโยงอุตสาหกรรมสมัยใหม่"
"131","Abernathy Ltd","durgan.alford@herzog.ac.th","พัฒนาสถาปัตยกรรมรูปแบบใหม่"
"132","Quigley Ltd","vkling@mayer.co.th","พัฒนาโครงสร้างอย่างมีประสิทธิภาพ"
"133","Hickle Ltd","rice.guiseppe@volkman.net.th","ประสานความคิดอย่างไร้ที่ติ"
"134","Kuhic Ltd","ankunding.dagmar@conn.ac.th","สรรสร้างอุตสาหกรรมที่โปร่งใส"
"135","Abbott Ltd","giles.ryan@dicki.go.th","เชื่อมต่อผู้ใช้เพื่อการเปลี่ยนแปลง"
"136","Gaylord Ltd","clementina64@beahan.net.th","เชื่อมโยงความคิดคุณภาพสากล"
"137","Kassulke Ltd","janie63@crona.th","เชื่อมต่อตลาด24 ชั่วโมง"
"138","Bogisich Ltd","nicolette.durgan@zboncak.com","ประสานระบบอย่างมีประสิทธิภาพ"
"139","Heidenreich Ltd","fgulgowski@mayer.or.th","พัฒนาความคิดอย่างมีประสิทธิภาพ"
"140","Quigley Ltd","sawayn.braxton@lind.co.th","เชื่อมโยงเครือข่ายอย่างสากล"
"141","Johns Ltd","aconroy@wintheiser.th","พัฒนาเนื้อหาพร้อมใช้งาน"
"142","Roob Ltd","catharine.predovic@bosco.net.th","พัฒนาเทคโนโลยีที่มีความหมาย"
"143","Kuhlman Ltd","edwardo84@pagac.mi.th","เปลี่ยนโครงสร้างพร้อมใช้งาน"
"144","Olson Ltd","mraz.kara@dickinson.co.th","ประสานความคิดคุณภาพสากล"
"145","Rosenbaum Ltd","bruen.curt@mccullough.net.th","พัฒนาเนื้อหาสู่ผู้บริโภค"
"146","Carroll Ltd","justine.jast@strosin.or.th","เชื่อมต่อโครงสร้างที่มีคุณค่า"
"147","Batz Ltd","cristal.okeefe@dooley.ac.th","สรรสร้างสถาปัตยกรรมอย่างไร้ที่ติ"
"148","Senger Ltd","duane.herzog@lakin.go.th","ประสานอุตสาหกรรมพร้อมใช้งาน"
"149","Kerluke Ltd","anthony.olson@lind.mi.th","ประสานโครงสร้างเพื่อการเปลี่ยนแปลง"
"150","Hamill Ltd","tillman.abigale@wuckert.or.th","เชื่อมโยงประสบการณ์24 ชั่วโมง"
"151","Connelly Ltd","dach.citlalli@pollich.go.th","ส่งเสริมสถาปัตยกรรมที่มีคุณค่า"
"152","Nienow Ltd","alene84@emmerich.mi.th","พัฒนาความคิดที่มีคุณค่า"
"153","Kovacek Ltd","arogahn@lindgren.mi.th","เชื่อมโยงผู้ใช้ที่มีคุณค่า"
"154","Kertzmann Ltd","mmarquardt@breitenberg.or.th","สรรสร้างระบบที่น่าดึงดูด"
"155","Franecki Ltd","kiley20@hane.net.th","ประสานเนื้อหาที่น่าดึงดูด"
"156","Jacobs Ltd","kenny03@mosciski.or.th","สรรสร้างโครงสร้างอย่างมีประสิทธิภาพ"
"157","Schamberger Ltd","jazmin.reichert@heller.net.th","เชื่อมต่อโครงสร้างที่สร้างสรรค์"
"158","Dietrich Ltd","pauline57@terry.net.th","ประสานประสบการณ์สมัยใหม่"
"159","Morar Ltd","dejah.klocko@christiansen.or.th","เชื่อมโยงผู้ใช้สมัยใหม่"
"160","Lesch Ltd","hahn.herta@spinka.co.th","ส่งเสริมตลาดที่โปร่งใส"
"161","Hagenes Ltd","frieda10@von.mi.th","ประสานประสบการณ์สู่ผู้บริโภค"
"162","Farrell Ltd","dave.windler@haley.ac.th","ประสานโครงสร้างรูปแบบใหม่"
"163","White Ltd","ddouglas@parisian.mi.th","เชื่อมโยงผู้ใช้ที่สร้างสรรค์"
"164","Volkman Ltd","jones.kenton@douglas.mi.th","เชื่อมโยงโครงสร้างเพื่อการเปลี่ยนแปลง"
"165","Berge Ltd","gutkowski.percy@bogisich.net.th","ประสานตลาดอย่างไร้ที่ติ"
"166","Langosh Ltd","kdavis@kertzmann.or.th","สรรสร้างอุตสาหกรรมรูปแบบใหม่"
"167","Schinner Ltd","ecasper@howe.or.th","เปลี่ยนโครงสร้างคุณภาพสากล"
"168","Schuppe Ltd","lbergstrom@heidenreich.co.th","สรรสร้างระบบอย่างไร้รอยต่อ"
"169","Williamson Ltd","laila26@kessler.co.th","พัฒนาอุตสาหกรรม24 ชั่วโมง"
"170","Hammes Ltd","mtremblay@kautzer.mi.th","พัฒนาอุตสาหกรรมอย่างมีประสิทธิภาพ"
"171","Kuhn Ltd","mrempel@rogahn.or.th","เชื่อมโยงผู้ใช้พร้อมใช้งาน"
"172","Jakubowski Ltd","wilkinson.joe@sanford.or.th","ส่งเสริมอุตสาหกรรมที่แข็งแกร่ง"
"173","West Ltd","johan.langosh@friesen.co.th","ส่งเสริมประสบการณ์ที่ปรับตัวได้"
"174","Rutherford Ltd","ibarton@corwin.go.th","เชื่อมต่อเทคโนโลยีที่โปร่งใส"
"175","Huels Ltd","jarod.gulgowski@wisoky.com","เชื่อมต่อตลาดสู่ผู้บริโภค"
"176","Smith Ltd","iherman@oconnell.ac.th","เชื่อมต่อระบบที่สร้างสรรค์"
"177","Schumm Ltd","rlesch@ledner.ac.th","เชื่อมต่อเนื้อหาเพื่อการเปลี่ยนแปลง"
"178","Mante Ltd","wilfredo.abbott@gutmann.co.th","เปลี่ยนความคิดสมัยใหม่"
"179","Hettinger Ltd","mraz.newton@mcdermott.go.th","เปลี่ยนเครือข่าย24 ชั่วโมง"
"180","Weimann Ltd","jquigley@pfeffer.ac.th","เชื่อมต่อระบบที่โปร่งใส"
"181","Ankunding Ltd","deron76@batz.ac.th","เปลี่ยนสถาปัตยกรรมที่สร้างสรรค์"
"182","Olson Ltd","mwisoky@johnson.in.th","เชื่อมต่ออุตสาหกรรมที่โปร่งใส"
"183","Cartwright Ltd","leonor.raynor@schamberger.ac.th","ประสานเครือข่ายอย่างสากล"
"184","Dare Ltd","okon.percival@schaefer.net.th","เชื่อมโยงเนื้อหาอย่างมีประสิทธิภาพ"
"185","Corwin Ltd","ejerde@okuneva.com","สรรสร้างเนื้อหาอย่างไร้รอยต่อ"
"186","Collier Ltd","funk.justine@schneider.th","เปลี่ยนประสบการณ์ที่มีความหมาย"
"187","Nicolas Ltd","schoen.dixie@anderson.th","พัฒนาตลาดที่โปร่งใส"
"188","Corwin Ltd","zoie.osinski@satterfield.mi.th","พัฒนาสถาปัตยกรรมอย่างไร้รอยต่อ"
"189","Padberg Ltd","jaeden.hammes@littel.in.th","เชื่อมโยงสถาปัตยกรรมที่สร้างสรรค์"
"190","Kris Ltd","julianne17@bartell.go.th","เปลี่ยนเนื้อหา24 ชั่วโมง"
"191","Wiza Ltd","pdickinson@gislason.mi.th","ประสานโครงสร้างสมัยใหม่"
"192","Christiansen Ltd","osmith@stamm.go.th","เปลี่ยนเทคโนโลยีสมัยใหม่"
"193","Bailey Ltd","richie.rutherford@pollich.th","ส่งเสริมโครงสร้างอย่างไร้รอยต่อ"
"194","Hickle Ltd","jennifer85@sawayn.in.th","เชื่อมโยงผู้ใช้คุณภาพสากล"
"195","Simonis Ltd","phills@hoeger.th","พัฒนาตลาดที่ปรับตัวได้"
"196","Gulgowski Ltd","aditya88@jacobs.th","ส่งเสริมระบบที่แข็งแกร่ง"
"197","Rosenbaum Ltd","king.cronin@mohr.com","สรรสร้างเทคโนโลยีที่ปรับตัวได้"
"198","Will Ltd","kraig43@yundt.mi.th","ประสานเครือข่ายสมัยใหม่"
"199","Brakus Ltd","gabrielle24@wilkinson.co.th","เชื่อมโยงผู้ใช้รูปแบบใหม่"
