id,fake-company-name,company-email,slogan
"200","Connelly Ltd","becker.hortense@hammes.or.th","พัฒนาตลาดที่น่าดึงดูด"
"201","Emmerich Ltd","cristopher.lynch@hettinger.net.th","เชื่อมโยงเทคโนโลยีที่มีคุณค่า"
"202","Dicki Ltd","gail36@dare.go.th","เปลี่ยนโครงสร้างอย่างไร้รอยต่อ"
"203","Reynolds Ltd","jasmin22@kiehn.th","ส่งเสริมเครือข่ายอย่างไร้ที่ติ"
"204","Ferry Ltd","barton.schneider@strosin.ac.th","ส่งเสริมอุตสาหกรรมที่สร้างสรรค์"
"205","Schulist Ltd","zkreiger@conroy.mi.th","ส่งเสริมอุตสาหกรรมที่มีคุณค่า"
"206","Cummings Ltd","emelie.ebert@eichmann.go.th","ส่งเสริมอุตสาหกรรมสู่ผู้บริโภค"
"207","Kautzer Ltd","idell.boehm@ryan.mi.th","สรรสร้างความคิดที่มีคุณค่า"
"208","Rutherford Ltd","alangosh@beier.or.th","สรรสร้างเครือข่ายอย่างสากล"
"209","Bruen Ltd","kgrady@kub.com","ส่งเสริมเครือข่ายรูปแบบใหม่"
"210","Brown Ltd","thuel@mayert.in.th","ส่งเสริมความคิดอย่างไร้รอยต่อ"
"211","Hayes Ltd","hnolan@rodriguez.th","เชื่อมโยงเทคโนโลยีรูปแบบใหม่"
"212","Batz Ltd","colleen.konopelski@kulas.ac.th","เชื่อมต่อโครงสร้างอย่างสากล"
"213","Leannon Ltd","damore.clementina@herzog.net.th","เชื่อมโยงตลาดที่มีคุณค่า"
"214","Kilback Ltd","xratke@bruen.go.th","ประสานเครือข่ายสู่ผู้บริโภค"
"215","Pouros Ltd","initzsche@grimes.co.th","เชื่อมต่อตลาด24 ชั่วโมง"
"216","Wyman Ltd","mhettinger@wolf.com","เชื่อมต่อความคิดอย่างไร้รอยต่อ"
"217","Hill Ltd","brandon.hansen@cormier.go.th","สรรสร้างสถาปัตยกรรมอย่างมีประสิทธิภาพ"
"218","Schulist Ltd","roberts.pattie@gaylord.go.th","สรรสร้างเนื้อหาที่น่าดึงดูด"
"219","Kreiger Ltd","lyric.wolff@thiel.go.th","เชื่อมต่อเนื้อหาคุณภาพสากล"
"220","Pfannerstill Ltd","shanna71@hirthe.mi.th","พัฒนาเนื้อหาที่มีความหมาย"
"221","Thiel Ltd","heller.ellie@paucek.com","เปลี่ยนความคิด24 ชั่วโมง"
"222","Harber Ltd","leonel31@gulgowski.co.th","ส่งเสริมประสบการณ์ที่ปรับตัวได้"
"223","Fay Ltd","cartwright.noelia@pfeffer.co.th","เปลี่ยนเทคโนโลยีที่สร้างสรรค์"
"224","Conroy Ltd","leopoldo.keebler@little.or.th","เชื่อมโยงตลาดอย่างไร้ที่ติ"
"225","Konopelski Ltd","schultz.cathryn@mayer.in.th","เชื่อมโยงตลาดสู่ผู้บริโภค"
"226","Kuhn Ltd","boyle.elva@weber.go.th","พัฒนาโครงสร้างที่น่าดึงดูด"
"227","King Ltd","kertzmann.lilyan@green.th","เชื่อมโยงเครือข่ายอย่างไร้รอยต่อ"
"228","Toy Ltd","legros.berry@bailey.or.th","เชื่อมต่อเนื้อหาที่แข็งแกร่ง"
"229","Bergnaum Ltd","diamond.kozey@reynolds.in.th","พัฒนาความคิดรูปแบบใหม่"
"230","Koelpin Ltd","theodora.lesch@mccullough.mi.th","เชื่อมโยงสถาปัตยกรรมที่สร้างสรรค์"
"231","Gusikowski Ltd","layne25@greenfelder.mi.th","พัฒนาประสบการณ์ที่ปรับตัวได้"
"232","Nienow Ltd","leonard66@ziemann.co.th","ประสานผู้ใช้ที่โปร่งใส"
"233","Strosin Ltd","mikayla.west@kuhic.in.th","สรรสร้างเนื้อหาอย่างมีประสิทธิภาพ"
"234","Wisozk Ltd","kessler.doris@cummings.go.th","ส่งเสริมเทคโนโลยีที่มีความหมาย"
"235","Breitenberg Ltd","wisoky.josh@zboncak.co.th","เชื่อมต่อเครือข่ายพร้อมใช้งาน"
"236","Lindgren Ltd","parisian.elmore@kris.th","เชื่อมโยงโครงสร้างอย่างมีประสิทธิภาพ"
"237","Huels Ltd","marcus.hagenes@nienow.go.th","เชื่อมโยงความคิดที่มีคุณค่า"
"238","Wehner Ltd","leilani.morar@haag.in.th","เชื่อมโยงความคิดที่มีความหมาย"
"239","Barrows Ltd","otremblay@mante.net.th","เชื่อมโยงความคิดที่โปร่งใส"
"240","Schoen Ltd","tgrimes@feeney.ac.th","เชื่อมต่อความคิดที่มีความหมาย"
"241","Rogahn Ltd","elijah65@schmeler.net.th","เชื่อมโยงตลาดที่มีคุณค่า"
"242","Kassulke Ltd","jaquan.blick@beer.ac.th","ส่งเสริมโครงสร้างที่สร้างสรรค์"
"243","Littel Ltd","tbauch@marks.net.th","สรรสร้างเนื้อหาสมัยใหม่"
"244","Corwin Ltd","lane.smith@zulauf.co.th","พัฒนาตลาดที่น่าดึงดูด"
"245","Thiel Ltd","ismael.casper@kassulke.mi.th","เปลี่ยนเครือข่ายพร้อมใช้งาน"
"246","Schiller Ltd","clowe@turcotte.ac.th","ส่งเสริมระบบที่ปรับตัวได้"
"247","Harris Ltd","mhagenes@hudson.or.th","พัฒนาประสบการณ์อย่างสากล"
"248","Lubowitz Ltd","jeremy18@hessel.or.th","เปลี่ยนอุตสาหกรรม24 ชั่วโมง"
"249","Mayert Ltd","rdickens@larson.in.th","เชื่อมโยงอุตสาหกรรมที่มีคุณค่า"
"250","Rosenbaum Ltd","okeefe.marilie@parisian.or.th","พัฒนาตลาดที่โปร่งใส"
"251","Collins Ltd","zaria.hammes@schowalter.co.th","ประสานสถาปัตยกรรมที่แข็งแกร่ง"
"252","Quigley Ltd","alysson75@vonrueden.co.th","ส่งเสริมผู้ใช้ที่น่าดึงดูด"
"253","Franecki Ltd","xglover@heaney.com","ส่งเสริมความคิดอย่างไร้ที่ติ"
"254","Labadie Ltd","pboehm@koelpin.go.th","สรรสร้างตลาดอย่างมีประสิทธิภาพ"
"255","Considine Ltd","etha76@hoeger.in.th","เชื่อมต่อเครือข่ายอย่างมีประสิทธิภาพ"
"256","Kihn Ltd","mertz.gabrielle@ullrich.net.th","ส่งเสริมตลาด24 ชั่วโมง"
"257","Terry Ltd","berenice50@oreilly.com","เชื่อมโยงเครือข่ายอย่างไร้รอยต่อ"
"258","Ernser Ltd","fabshire@ankunding.th","ส่งเสริมความคิดที่สร้างสรรค์"
"259","Hackett Ltd","antonia33@miller.com","ประสานประสบการณ์ที่สร้างสรรค์"
"260","Swaniawski Ltd","keely.kunze@jaskolski.mi.th","เชื่อมโยงเครือข่ายสู่ผู้บริโภค"
"261","Lueilwitz Ltd","vpfeffer@terry.net.th","ประสานโครงสร้างรูปแบบใหม่"
"262","Cronin Ltd","chris41@bartoletti.ac.th","ประสานประสบการณ์เพื่อการเปลี่ยนแปลง"
"263","Nikolaus Ltd","mossie.ohara@bartell.mi.th","เชื่อมต่อผู้ใช้คุณภาพสากล"
"264","Pfannerstill Ltd","tcasper@stark.th","พัฒนาเทคโนโลยีอย่างไร้ที่ติ"
"265","Emard Ltd","brendon.cremin@douglas.in.th","เชื่อมต่อโครงสร้างอย่างไร้ที่ติ"
"266","Fadel Ltd","frankie75@rosenbaum.go.th","ส่งเสริมผู้ใช้ที่แข็งแกร่ง"
"267","Wyman Ltd","msmith@satterfield.go.th","สรรสร้างสถาปัตยกรรมอย่างมีประสิทธิภาพ"
"268","Sanford Ltd","alphonso.lesch@aufderhar.com","เชื่อมโยงระบบที่มีความหมาย"
"269","Walter Ltd","dalton.parisian@price.or.th","เชื่อมโยงผู้ใช้ที่น่าดึงดูด"
"270","Moore Ltd","walsh.chet@haag.co.th","เชื่อมโยงสถาปัตยกรรมที่น่าดึงดูด"
"271","Nader Ltd","johnny.white@goldner.go.th","เชื่อมโยงความคิดอย่างไร้รอยต่อ"
"272","Reichel Ltd","simone.padberg@kunde.th","พัฒนาระบบที่น่าดึงดูด"
"273","Kuhlman Ltd","ookuneva@heidenreich.th","เปลี่ยนเนื้อหาอย่างไร้ที่ติ"
"274","Boehm Ltd","kasey54@fritsch.in.th","ประสานผู้ใช้เพื่อการเปลี่ยนแปลง"
"275","Bailey Ltd","gerlach.ashtyn@brown.in.th","สรรสร้างประสบการณ์สมัยใหม่"
"276","Legros Ltd","omclaughlin@okon.com","สรรสร้างประสบการณ์สู่ผู้บริโภค"
"277","Batz Ltd","camryn16@mueller.in.th","เชื่อมต่ออุตสาหกรรมอย่างไร้รอยต่อ"
"278","Schmeler Ltd","qlangworth@kuvalis.com","เชื่อมโยงระบบที่มีความหมาย"
"279","Kutch Ltd","donnell.pfeffer@kris.net.th","สรรสร้างโครงสร้างพร้อมใช้งาน"
"280","Torp Ltd","quigley.rita@mosciski.go.th","พัฒนาผู้ใช้รูปแบบใหม่"
"281","Quigley Ltd","hand.rosalia@marks.co.th","เปลี่ยนเทคโนโลยีที่น่าดึงดูด"
"282","Kris Ltd","tremayne27@lebsack.or.th","เชื่อมต่อโครงสร้างสมัยใหม่"
"283","Baumbach Ltd","cbuckridge@rowe.ac.th","ประสานเนื้อหาที่น่าดึงดูด"
"284","Shields Ltd","eunice.zboncak@hilpert.mi.th","พัฒนาเทคโนโลยีสมัยใหม่"
"285","Hirthe Ltd","candido.dickens@crona.go.th","ส่งเสริมประสบการณ์อย่างไร้ที่ติ"
"286","Johns Ltd","kade57@mitchell.com","ประสานอุตสาหกรรมที่แข็งแกร่ง"
"287","Leannon Ltd","zoila.barton@sawayn.ac.th","พัฒนาสถาปัตยกรรมที่แข็งแกร่ง"
"288","Stroman Ltd","lilly84@huel.co.th","สรรสร้างความคิดอย่างไร้รอยต่อ"
"289","Jerde Ltd","enolan@rau.com","เชื่อมโยงโครงสร้างสู่ผู้บริโภค"
"290","Mayer Ltd","leda80@oconner.com","สรรสร้างเทคโนโลยีที่น่าดึงดูด"
"291","Hackett Ltd","martin.krajcik@schinner.mi.th","เชื่อมโยงเทคโนโลยีที่มีคุณค่า"
"292","Rowe Ltd","witting.wilber@cassin.co.th","สรรสร้างเนื้อหาสู่ผู้บริโภค"
"293","Quigley Ltd","hills.ima@glover.or.th","สรรสร้างเทคโนโลยีที่แข็งแกร่ง"
"294","Quigley Ltd","hilpert.beryl@renner.com","เชื่อมโยงระบบสู่ผู้บริโภค"
"295","Reinger Ltd","alessandra94@aufderhar.in.th","ส่งเสริมประสบการณ์ที่โปร่งใส"
"296","Rohan Ltd","stanton.jazmyne@ryan.ac.th","เชื่อมต่ออุตสาหกรรมเพื่อการเปลี่ยนแปลง"
"297","Gutkowski Ltd","thad.boyer@fay.mi.th","พัฒนาประสบการณ์24 ชั่วโมง"
"298","Jaskolski Ltd","breitenberg.elouise@kohler.com","สรรสร้างเทคโนโลยีสู่ผู้บริโภค"
"299","Jacobson Ltd","ofelia.medhurst@mckenzie.ac.th","ส่งเสริมความคิดที่ปรับตัวได้"
"300","Wisoky Ltd","zgutmann@bechtelar.ac.th","ส่งเสริมสถาปัตยกรรม24 ชั่วโมง"
"301","Douglas Ltd","rashad84@smitham.net.th","เปลี่ยนสถาปัตยกรรมที่น่าดึงดูด"
"302","Runolfsson Ltd","rosemarie85@nader.mi.th","สรรสร้างเครือข่ายที่น่าดึงดูด"
"303","Marks Ltd","lenore.jast@hoppe.in.th","พัฒนาผู้ใช้สมัยใหม่"
"304","Runte Ltd","stan30@beahan.in.th","เชื่อมต่อระบบที่มีคุณค่า"
"305","Roob Ltd","fcormier@quigley.or.th","สรรสร้างประสบการณ์รูปแบบใหม่"
"306","Lang Ltd","vicky32@fadel.net.th","ส่งเสริมอุตสาหกรรมที่ปรับตัวได้"
"307","Lehner Ltd","tatum42@homenick.or.th","ส่งเสริมระบบที่มีคุณค่า"
"308","Nitzsche Ltd","lswaniawski@schulist.mi.th","เชื่อมต่อประสบการณ์พร้อมใช้งาน"
"309","Dickinson Ltd","tyrique.stanton@olson.th","เชื่อมต่อตลาดที่สร้างสรรค์"
"310","Mann Ltd","wyman.bella@kautzer.co.th","เชื่อมต่อประสบการณ์ที่มีความหมาย"
"311","Crist Ltd","nitzsche.burdette@hessel.in.th","เชื่อมต่อสถาปัตยกรรมที่แข็งแกร่ง"
"312","Leffler Ltd","vskiles@davis.or.th","เปลี่ยนเนื้อหาที่โปร่งใส"
"313","Grimes Ltd","waldo23@becker.ac.th","พัฒนาอุตสาหกรรมที่มีคุณค่า"
"314","Romaguera Ltd","mae30@koss.net.th","ส่งเสริมความคิดที่ปรับตัวได้"
"315","Stroman Ltd","ecartwright@brown.net.th","พัฒนาเทคโนโลยีอย่างมีประสิทธิภาพ"
"316","Quigley Ltd","flarkin@hintz.net.th","ประสานตลาดที่สร้างสรรค์"
"317","Upton Ltd","carlotta.kshlerin@stroman.ac.th","ประสานระบบที่มีคุณค่า"
"318","Gibson Ltd","schuster.nakia@conroy.ac.th","สรรสร้างเนื้อหาอย่างมีประสิทธิภาพ"
"319","Bode Ltd","pbogisich@purdy.mi.th","เชื่อมต่อโครงสร้างเพื่อการเปลี่ยนแปลง"
"320","Purdy Ltd","collier.talon@gusikowski.mi.th","ส่งเสริมผู้ใช้สมัยใหม่"
"321","Marquardt Ltd","dhoppe@crist.in.th","ส่งเสริมความคิดอย่างมีประสิทธิภาพ"
"322","Bernier Ltd","xsporer@hansen.go.th","เชื่อมโยงเนื้อหาคุณภาพสากล"
"323","Auer Ltd","qwilderman@crona.co.th","พัฒนาโครงสร้างที่แข็งแกร่ง"
"324","Ryan Ltd","kassulke.janiya@dicki.in.th","ส่งเสริมตลาดที่มีความหมาย"
"325","Turner Ltd","hessel.crawford@lebsack.co.th","ส่งเสริมระบบอย่างไร้ที่ติ"
"326","Huel Ltd","qbalistreri@johnson.mi.th","เชื่อมต่อความคิดที่สร้างสรรค์"
"327","Blanda Ltd","stoltenberg.mohamed@abernathy.go.th","สรรสร้างอุตสาหกรรมรูปแบบใหม่"
"328","Bogan Ltd","jude41@wunsch.mi.th","พัฒนาระบบสู่ผู้บริโภค"
"329","Stanton Ltd","terry.cyril@quitzon.ac.th","ประสานเนื้อหารูปแบบใหม่"
"330","Runte Ltd","abigail20@heaney.go.th","เปลี่ยนตลาดที่โปร่งใส"
"331","Swaniawski Ltd","schinner.jordi@schmeler.or.th","เชื่อมต่ออุตสาหกรรมสู่ผู้บริโภค"
"332","Bartoletti Ltd","ivory73@torp.mi.th","เปลี่ยนโครงสร้างพร้อมใช้งาน"
"333","Boyle Ltd","nyah15@medhurst.go.th","สรรสร้างผู้ใช้เพื่อการเปลี่ยนแปลง"
"334","Grant Ltd","terry.lenna@jenkins.or.th","พัฒนาอุตสาหกรรมที่มีคุณค่า"
"335","Bosco Ltd","garfield.ledner@gutmann.net.th","เชื่อมต่อโครงสร้าง24 ชั่วโมง"
"336","Cormier Ltd","schuppe.micah@oberbrunner.co.th","เชื่อมต่อระบบที่สร้างสรรค์"
"337","Blick Ltd","delta.larson@turcotte.go.th","เชื่อมต่อตลาดคุณภาพสากล"
"338","Kessler Ltd","ajohns@romaguera.th","สรรสร้างผู้ใช้อย่างสากล"
"339","Dach Ltd","lueilwitz.luna@gleichner.ac.th","เชื่อมต่อประสบการณ์ที่ปรับตัวได้"
"340","Bergnaum Ltd","stanton.cristobal@stokes.mi.th","ประสานสถาปัตยกรรมที่สร้างสรรค์"
"341","West Ltd","afunk@kling.in.th","เชื่อมต่ออุตสาหกรรมที่มีความหมาย"
"342","Schaden Ltd","lkuhic@cruickshank.net.th","เชื่อมต่อตลาดที่มีความหมาย"
"343","Gerlach Ltd","fatima.veum@feeney.th","ส่งเสริมอุตสาหกรรมที่มีความหมาย"
"344","Jacobson Ltd","sbosco@hackett.co.th","เชื่อมต่อตลาดอย่างมีประสิทธิภาพ"
"345","Reinger Ltd","iwillms@medhurst.mi.th","เชื่อมต่ออุตสาหกรรมที่โปร่งใส"
"346","Fritsch Ltd","deon52@goldner.or.th","เปลี่ยนเครือข่ายสมัยใหม่"
"347","Kulas Ltd","ustokes@heaney.go.th","สรรสร้างอุตสาหกรรมที่มีความหมาย"
"348","Nader Ltd","letitia22@goodwin.go.th","สรรสร้างอุตสาหกรรมคุณภาพสากล"
"349","Murphy Ltd","colleen89@ernser.com","ประสานเนื้อหาอย่างสากล"
"350","Johnston Ltd","macejkovic.heaven@bergnaum.co.th","เชื่อมโยงอุตสาหกรรมอย่างสากล"
"351","Bernier Ltd","pattie.hermann@hermiston.in.th","สรรสร้างผู้ใช้24 ชั่วโมง"
"352","Hahn Ltd","pedro.bernhard@waters.ac.th","ส่งเสริมผู้ใช้ที่โปร่งใส"
"353","Stiedemann Ltd","joey76@effertz.co.th","เปลี่ยนโครงสร้างที่มีคุณค่า"
"354","Pouros Ltd","noel.von@johnson.in.th","ส่งเสริมตลาดคุณภาพสากล"
"355","Braun Ltd","elisa42@block.th","เชื่อมต่อเนื้อหาที่มีความหมาย"
"356","Casper Ltd","furman43@mayert.ac.th","ส่งเสริมตลาดที่แข็งแกร่ง"
"357","Hudson Ltd","champlin.myrtis@streich.net.th","เชื่อมโยงอุตสาหกรรมที่มีคุณค่า"
"358","Torphy Ltd","baumbach.keshaun@ryan.in.th","เปลี่ยนตลาดที่มีความหมาย"
"359","Torp Ltd","okon.kieran@donnelly.mi.th","เปลี่ยนเนื้อหาสมัยใหม่"
"360","Kunze Ltd","jermey.grimes@spencer.com","ประสานอุตสาหกรรมเพื่อการเปลี่ยนแปลง"
"361","Torphy Ltd","considine.dandre@batz.in.th","ส่งเสริมตลาดอย่างมีประสิทธิภาพ"
"362","Dietrich Ltd","mitchell.gregg@smith.net.th","ประสานประสบการณ์อย่างไร้รอยต่อ"
"363","Thompson Ltd","kzulauf@von.or.th","ส่งเสริมเทคโนโลยีอย่างไร้ที่ติ"
"364","Predovic Ltd","annalise.adams@veum.go.th","ส่งเสริมผู้ใช้ที่แข็งแกร่ง"
"365","Labadie Ltd","bogan.sanford@stokes.mi.th","พัฒนาเนื้อหาที่สร้างสรรค์"
"366","Veum Ltd","rozella79@schmitt.mi.th","เชื่อมโยงเครือข่ายอย่างสากล"
"367","Boehm Ltd","ukshlerin@brakus.com","เชื่อมโยงตลาดอย่างไร้รอยต่อ"
"368","Hessel Ltd","avery15@nicolas.or.th","สรรสร้างระบบอย่างไร้รอยต่อ"
"369","Hermiston Ltd","ybeer@ritchie.net.th","พัฒนาประสบการณ์อย่างสากล"
"370","Ritchie Ltd","filiberto.fahey@kovacek.mi.th","เชื่อมต่อตลาด24 ชั่วโมง"
"371","Konopelski Ltd","dolores49@osinski.th","พัฒนาประสบการณ์อย่างมีประสิทธิภาพ"
"372","Koss Ltd","sdavis@boehm.ac.th","ส่งเสริมความคิดอย่างไร้ที่ติ"
"373","Funk Ltd","kattie.yundt@wyman.in.th","ประสานความคิดพร้อมใช้งาน"
"374","Hahn Ltd","maureen71@hickle.mi.th","พัฒนาความคิดพร้อมใช้งาน"
"375","Olson Ltd","stokes.liana@streich.mi.th","ประสานประสบการณ์ที่โปร่งใส"
"376","Emmerich Ltd","okuneva.tatyana@fadel.mi.th","เปลี่ยนโครงสร้างที่สร้างสรรค์"
"377","Wiza Ltd","issac.bosco@bernhard.th","สรรสร้างเนื้อหาอย่างสากล"
"378","Gottlieb Ltd","amy84@sipes.go.th","พัฒนาอุตสาหกรรมอย่างไร้ที่ติ"
"379","Haag Ltd","veum.blaze@will.or.th","ประสานเทคโนโลยีที่ปรับตัวได้"
"380","Rice Ltd","jakob21@gerhold.or.th","พัฒนาเครือข่ายอย่างสากล"
"381","Erdman Ltd","bklein@bauch.th","พัฒนาประสบการณ์พร้อมใช้งาน"
"382","Gerhold Ltd","klocko.johanna@hudson.ac.th","สรรสร้างตลาดที่แข็งแกร่ง"
"383","Quitzon Ltd","cmetz@schiller.com","ส่งเสริมตลาดอย่างมีประสิทธิภาพ"
"384","Rippin Ltd","sziemann@crist.in.th","สรรสร้างตลาดอย่างสากล"
"385","Weissnat Ltd","plowe@wolf.mi.th","ประสานระบบที่มีคุณค่า"
"386","Kuphal Ltd","larue.schmitt@nikolaus.ac.th","สรรสร้างเนื้อหาที่มีความหมาย"
"387","Wilderman Ltd","qhudson@green.go.th","สรรสร้างสถาปัตยกรรมที่แข็งแกร่ง"
"388","Kuhn Ltd","feeney.theresa@balistreri.th","พัฒนาประสบการณ์สู่ผู้บริโภค"
"389","Green Ltd","joanny12@boyer.th","สรรสร้างเทคโนโลยีที่โปร่งใส"
"390","Tremblay Ltd","leda59@wolff.th","สรรสร้างประสบการณ์ที่มีความหมาย"
"391","Cronin Ltd","marianna52@balistreri.mi.th","ส่งเสริมผู้ใช้อย่างสากล"
"392","Wolff Ltd","cornelius05@spinka.com","เปลี่ยนสถาปัตยกรรมสู่ผู้บริโภค"
"393","Kuphal Ltd","clovis.bruen@walsh.ac.th","เปลี่ยนเทคโนโลยีสมัยใหม่"
"394","Gerlach Ltd","verlie.wilderman@kreiger.or.th","เชื่อมต่ออุตสาหกรรมสมัยใหม่"
"395","Schiller Ltd","scotty84@conroy.in.th","เชื่อมโยงความคิดที่สร้างสรรค์"
"396","Ortiz Ltd","doris.quigley@mosciski.co.th","เชื่อมต่อเครือข่ายที่แข็งแกร่ง"
"397","Abshire Ltd","kenyon.von@schamberger.mi.th","พัฒนาสถาปัตยกรรมรูปแบบใหม่"
